;author;body;controversiality;created;link_id;permalink
0;FredCDex;You need to contact Stepn support. Good luck with that !;0;2022-05-23 15:58:36;t3_uw0825;/r/StepN/comments/uw0825/i_lost_access_to_my_google_authenticator_code/i9p324k/
1;Wonderful-Court926;"It seems we don't have access to the transactions that happen within ""spending"" exchange (GST/GMT created/made and the purchase of shoes and other things on the marketplace). I see the transaction history between spending and stepn wallet and between stepn wallet and outside the app. Any advice on how to locate this if it is available. Taxes will be impossible without this information. I'm tracking on Google Sheets as much as possible...but not the first week I started.";0;2022-05-23 15:46:06;t3_uvzjmp;/r/StepN/comments/uvzjmp/stepn_bought_shoes_transaction_history/i9p1a1e/
2;misterbombasticxrp;Does stepn works with apple watch? Or just use my phone tracking?;0;2022-05-23 15:40:49;t3_uvsnea;/r/StepN/comments/uvsnea/i_invested_33k_into_stepn_just_38_days_ago_heres/i9p0j53/
3;Stiltzkinn;If you think this is like Luna you should think twice about using your money on any crypto related project. Before using money on any project do your research and read the whitepaper, StepN whitepaper has all the details you need to know.;0;2022-05-23 15:40:19;t3_uvsnea;/r/StepN/comments/uvsnea/i_invested_33k_into_stepn_just_38_days_ago_heres/i9p0gj7/
4;Mindless_Speed_7645;Here’s a link for access to activation codes at a STEPn Discord chat group https://discord.gg/AGkKEfryub;0;2022-05-23 15:17:11;t3_uvu4c5;/r/StepN/comments/uvu4c5/hello_can_somebody_send_me_an_invitation_code_in/i9ox6uu/
5;Mindless_Speed_7645;Here’s a link for access to activation codes at a STEPn Discord chat group https://discord.gg/AGkKEfryub;0;2022-05-23 15:16:56;t3_uvuc87;/r/StepN/comments/uvuc87/code_46553501/i9ox5mc/
6;MrDT-Bandung;That's where you go when you want to apply as STEPN software engineer. (?) #maybe;0;2022-05-23 14:47:02;t3_uvv5oq;/r/StepN/comments/uvv5oq/stepn_agency/i9ot2ze/
7;Mindless_Speed_7645;Here’s a link for access to activation codes at a STEPn Discord chat group https://discord.gg/AGkKEfryub;0;2022-05-23 14:47:00;t3_uvymdg;/r/StepN/comments/uvymdg/help_for_newcomers/i9ot2sv/
8;Mindless_Speed_7645;Here’s a link for access to activation codes at a STEPn Discord chat group https://discord.gg/AGkKEfryub;0;2022-05-23 14:46:21;t3_uvyss8;/r/StepN/comments/uvyss8/guys_please_i_need_3_activation_code_help_me/i9oszkl/
9;Mindless_Speed_7645;Here’s a link for access to activation codes at a STEPn Discord chat group https://discord.gg/AGkKEfryub;0;2022-05-23 14:41:02;t3_uvzvuc;/r/StepN/comments/uvzvuc/activation_code_35626116/i9os9uw/
10;Pi11r0113r;I would type all of the attributes into Stepn guide and see what the ROI would look like compared to a similar trainer.  Just write it all down so you can compare.;0;2022-05-23 14:39:09;t3_uvs2p0;/r/StepN/comments/uvs2p0/i_have_a_lvl_19_common_walker_any_point_using/i9os0hj/
11;Mindless_Speed_7645;Here’s a link for access to activation codes at a STEPn Discord chat group https://discord.gg/AGkKEfryub;0;2022-05-23 14:37:58;t3_uw0w7f;/r/StepN/comments/uw0w7f/42937040_welcome/i9orus8/
12;Inside_Sail_8756;You can change the GST you earned on Sol chain to Sol and transfer it to an exchange (I use binance but at the moment it's terrible with Sol. Therefore I exchange GST to Sol, transfer Sol to Coinbase, change them to btc, send that btc  to binance, convert btc to bnb, send bnb to bnb wallet in stepn). But keep on mind the GST from the Sol chain is worth aprox 3 dollar and the GST from bnb chain is worth 18 dollars (it's very volatile). They are 2 SEPERATE coins which share the same name.;0;2022-05-23 14:33:58;t3_uvsnea;/r/StepN/comments/uvsnea/i_invested_33k_into_stepn_just_38_days_ago_heres/i9orb6k/
13;TheWorldCOC;yes convert to sol and transfer . both phones have a seperate connected sol wallet (phantom). to cash out or buy crypto to invest in stepn with I have a binance wallet;0;2022-05-23 14:21:12;t3_uvsnea;/r/StepN/comments/uvsnea/i_invested_33k_into_stepn_just_38_days_ago_heres/i9opm9c/
14;gummynator70;if you still have your old phone you can export the link to stepn to your new phone. open authenticator on old phone and click on 3 dots. go to accounts and click on export. scan the code under import with new phone.;0;2022-05-23 14:09:01;t3_uw0825;/r/StepN/comments/uw0825/i_lost_access_to_my_google_authenticator_code/i9oo1ky/
15;vicodinchik;Yeah for some. I do 200-250 km/mo and I bought jogger to do stepn steps apart of running. I wouldn’t be able to use runners, not so experienced yet;0;2022-05-23 13:44:33;t3_uvginu;/r/StepN/comments/uvginu/hey_everyone_i_currently_have_a_level_16_runner/i9oky1z/
16;Fuddemy;What on earth does a StepN agent do?;0;2022-05-23 12:58:32;t3_uvv5oq;/r/StepN/comments/uvv5oq/stepn_agency/i9ofihu/
17;Sergio_Andre;If this is true. The stepn could add an extra: “if you cheat again after cooldown you’ll loose all your sneakers, gems and all your assets and be banned forever” 😂;0;2022-05-23 12:56:55;t3_uvym9w;/r/StepN/comments/uvym9w/fake/i9ofc8g/
18;CriptoGui;"this may help you: 

\*\*\*\*\*\*\*\*\*\*\*\*\*\*\*\*\*\*\*\*\*\*\*

crypto-acct·2 mo. ago  
This is from the discord channel:  
  
ANNOUNCEMENT:  
  
Hello u/everyone.  
  
We have received several reports of delayed transactions and/or missing assets/tokens after purchases/transfers.  
  
As you may already be aware, Solana sometimes has network congestions that result in transactions taking hours to complete.  
  
For now, please give any transaction 24 hours to self-solve. This includes wallet-to-spending, spending-to-wallet, and wallet-to-wallet transfers.  
  
If you're still experiencing issues even after waiting for 24 hours, please tag me &lt;@!372422575818539029&gt; so I can help you.  
  
Thank you!  

&amp;#x200B;

\*\*\*\*\*\*\*\*\*\*\*\*\*\*\*\*\*\*\*\*\*\*\*

sorry can't send links( yet) but you can check the original post on google using this:

/StepN/comments/tsw44x/nft\_transfer\_to\_wallet/i2ttza8/";0;2022-05-23 12:55:24;t3_uvzaui;/r/StepN/comments/uvzaui/transferred_shoe_is_not_appearing_in_wallet/i9of63z/
19;Capable_Gift8543;Can anyone help me please? Trying to contact Stepn for hours. Tried email, discord, telegram and here. No reply, no support, just a lot of impostors thing to rob me more.;0;2022-05-23 12:49:19;t3_uvv2jl;/r/StepN/comments/uvv2jl/i_need_some_help_please_my_account_was_hacked_and/i9oei22/
20;Plane_Control_6218;And Stepn is not a Ponzi because the $380 OP gets out of the system everyday come from…?;0;2022-05-23 12:28:33;t3_uvsnea;/r/StepN/comments/uvsnea/i_invested_33k_into_stepn_just_38_days_ago_heres/i9ocb05/
21;migrantmoreno;U have to transfer to your bnb walet on stepn.  Or u can transfer gmt, gat, or usdc and convert it to bnb in the app;0;2022-05-23 11:59:49;t3_uvinnc;/r/StepN/comments/uvinnc/im_making_800_a_day_with_9_shoes/i9o9hh7/
22;ulti72;"No, according to stepn guide, not needed.. 
2.46 gst repair cost currently i am giving";0;2022-05-23 11:34:30;t3_uqmo13;/r/StepN/comments/uqmo13/finally_upgraded_to_lvl_9/i9o760y/
23;Eastern_Mountain_781;Just wanted to double check if it is possible to deposit GMT into the stepn wallet? I could not find any videos or information about it online. Wondering If anyone has performed similar transactions?;0;2022-05-23 11:31:40;t3_uvy22i;/r/StepN/comments/uvy22i/can_i_transfer_gmt_into_stepn_wallet/i9o6wta/
24;GavinR10;I think it’s a risk, I’ve heard STEPN are looking into changing cross chains. I would probably think they will be individual meaning you will need all sol shoes or all BNB shoes. Right at this current time it is extremely profitable to have numerous sol shoes and have 1 high level BNB;0;2022-05-23 11:11:09;t3_uvxoxj;/r/StepN/comments/uvxoxj/switching_from_sol_to_bsc_for_earning/i9o5681/
25;CryptoMark00;"Anyone of you haven't heard that StepN will implement a way to reset all the points to be able to redistribute them? It's coming ""soon"".";0;2022-05-23 11:06:51;t3_uvtvzl;/r/StepN/comments/uvtvzl/why_would_anyone_distribute_attributes_like_this/i9o4tlt/
26;Inside_Sail_8756;you can see it here [https://dune.com/](https://dune.com/lightsoutjames/STEPN-Dashboard) .Please let me know if you notice something strange, i´m also very heavily invested.;0;2022-05-23 11:02:06;t3_uvar3x;/r/StepN/comments/uvar3x/i_saw_this_video_and_i_was_wondering_how_long_you/i9o4fij/
27;2daysb4dayafter2mro;When did the stepn nfts game come out? Are we really early or have they peaked already?;0;2022-05-23 10:59:04;t3_uvv5oq;/r/StepN/comments/uvv5oq/stepn_agency/i9o46nj/
28;AhmetVefaKoc;"https://www.reddit.com/r/StepN/comments/uvxa7l/a_brief_summary_of_everything/?utm_source=share&amp;utm_medium=ios_app&amp;utm_name=iossmf

I’ve also created this post. You might want to check it out.";0;2022-05-23 10:49:58;t3_uvx3iu;/r/StepN/comments/uvx3iu/can_i_send_shoes_from_solana_network_wallet_to/i9o3gvf/
29;2daysb4dayafter2mro;You can't lift weights with stepn.;0;2022-05-23 10:48:55;t3_uve7sj;/r/StepN/comments/uve7sj/why_i_dont_care_if_stepn_is_ponzi/i9o3dxh/
30;Ill_Ad_9854;Thank you very much! I don’t really have much extra money to buy any sneakers right now. So maybe I will buy one and start using Stepn when I can afford it!;0;2022-05-23 10:46:02;t3_uvvoaj;/r/StepN/comments/uvvoaj/struggling_photographer_here_it_would_be_very/i9o35xm/
31;murlock991;anyone needs code? I can give code if you wanna invest money in stepn app!;0;2022-05-23 10:12:53;t3_qcknwv;/r/StepN/comments/qcknwv/rstepn_lounge/i9o0rn7/
32;Boniface134;who really needs code - send me message. Codes for real persons who will use stepn app 100%;0;2022-05-23 10:05:19;t3_qcknwv;/r/StepN/comments/qcknwv/rstepn_lounge/i9o08vw/
33;move2earnphysio;"To listen as a podcast - [https://anchor.fm/stepninjurypreventionpod/episodes/Is-stretching-important-for-runners----Episode-21-e1iu39u](https://anchor.fm/stepninjurypreventionpod/episodes/Is-stretching-important-for-runners----Episode-21-e1iu39u)  
\_\_\_\_\_\_\_\_\_\_\_\_\_\_\_\_\_\_\_\_\_\_\_\_\_\_\_\_\_\_\_\_\_\_\_\_\_\_\_\_\_\_\_\_\_\_\_\_\_\_\_\_\_\_\_\_\_\_\_\_\_\_\_\_\_\_\_\_\_\_

So many of my patients think not enough stretching is the reason they have sore muscles, get injured and cannot perform at their best.    
Today I dive into whether stretching is as important for runners as so many people seem to think.  
\_\_\_\_\_\_\_\_\_\_\_\_\_\_\_\_\_\_\_\_\_\_\_\_\_\_\_\_\_\_\_\_\_\_\_\_\_\_\_\_\_\_\_\_\_\_\_\_\_\_\_\_\_\_\_\_\_\_\_\_\_\_\_\_\_\_\_\_\_\_\_  
Do you have a follow up question from the episode or have a request for an episode?   
Let me know in the comments.   
Any feedback is appreciated. Good or bad.  
\_\_\_\_\_\_\_\_\_\_\_\_\_\_\_\_\_\_\_\_\_\_\_\_\_\_\_\_\_\_\_\_\_\_\_\_\_\_\_\_\_\_\_\_\_\_\_\_\_\_\_\_\_\_\_\_\_\_\_\_\_\_\_\_\_\_\_\_\_\_\_  
  
If you are getting value out of what I am doing, consider donating GST, GMT or Sol to Cwu2WA6y86zxiL2XLwbxVHpn7R3vBs1tK3pQcXJYwctt  
  
If you haven't already, join the STEPN injury Prevention Group to ask questions and gain access to resources - https://www.facebook.com/groups/stepninjurypreventiongroup     
  
I have also set a YouTube channel. Subscribing would be very helpful :) https://www.youtube.com/channel/UCIY3RdHlxQNA\_SrFC1BqRFw  
  
\*\*Disclaimer - As I have not seen you as a patient, what I am saying is not medical advice. Make sure you work with a healthcare practitioner if you have any pain, injury or medical conditions\*\*";0;2022-05-23 09:30:32;t3_uvwc6d;/r/StepN/comments/uvwc6d/is_stretching_important_for_runners_stepn_injury/i9nxwp6/
34;Ill_Ad_9854;A very kind person gave me the activation code!! Thank you stepn community!;0;2022-05-23 08:54:41;t3_uvvoaj;/r/StepN/comments/uvvoaj/struggling_photographer_here_it_would_be_very/i9nvlmx/
35;hosseinkhan123456;"Hello good time  
In the STEPN program, I charged my account to Solna 13 to pay for shoes.  
Sorry, the program was automatically logged out  
And then no matter how hard I tried to login again, I got the error that the password or username was wrong  
Anyway, I logged in again today with the new activation code  
I entered the 12-word Walt password, but it's zero since I deposited 13 SOLNAs into Walt's spanding account.  
The spanding account is also zero  
Total game inventory is zero  
But it shows the history of receiving Solna in Walt.  
Please tell me what to do?  
Thank you";0;2022-05-23 08:46:05;t3_qcknwv;/r/StepN/comments/qcknwv/rstepn_lounge/i9nv1hz/
36;JugobetrugoN1;"My assumption: it probably will get one big pump.

Up to this date, mainstream media hasn’t acknowledged STEPN. If mainstream media and more YouTubers covers STEPN, imagine what will happen to stepn. We will get a huge influx of new players. The player base is still relatively small with around 2.3 million monthly users. So my assumption is that gst will probably raise in the upcoming months. Especially if the crypto market recovers.";0;2022-05-23 07:59:24;t3_uvuxxz;/r/StepN/comments/uvuxxz/will_this_game_be_at_these_earnings_in_next_3/i9ns2tn/
37;38legs;What do you mean? Sorry I’m not sure I know the difference, I’ve done everything on STEPN via SOL;0;2022-05-23 07:22:58;t3_uvsnea;/r/StepN/comments/uvsnea/i_invested_33k_into_stepn_just_38_days_ago_heres/i9npp1s/
38;ozomidaf;"Are you really making so much money? Or are you making GST and using this ""money"" to buy more shoes in STEPN etc.?  
I really do hope you get to cash this money into FIAT. Because, you know, normal stock market rule is - if you do not cash it, you didn't earn a dime.";0;2022-05-23 07:17:01;t3_uvinnc;/r/StepN/comments/uvinnc/im_making_800_a_day_with_9_shoes/i9np9wt/
39;StrUN_;I have read the Whitepaper, watched videos on the official site and used STEPN Guide and Calculators to direct me to the correct sneaker. I don't recall any info about the attribution setting. This is why I'm asking for suggestions like selling it/upgrading it etc. The damage is already done;0;2022-05-23 06:35:41;t3_uvtvzl;/r/StepN/comments/uvtvzl/why_would_anyone_distribute_attributes_like_this/i9nmao3/
40;Rikerslash;100% this. I do not play this game yet but seeing people people break the economy at the cost of everyone else and the developers not doing any hotfix for something which is basically a bug is a huge red flag. How long is this situation in the game? People seem to not have a problem though even if these people totally abuse the economy. This is caused by stepn though and the players are obv not to blame for this situation.;0;2022-05-23 06:25:38;t3_uvml3c;/r/StepN/comments/uvml3c/guys_there_is_something_i_really_dont_understand/i9nljob/
41;HomeworkCold3416;"It's more of a ponzi but I think we're having a wrong discussion here.
It doesn't matter that it's a ponzi IF it has a wide adoption.
Stock market is a ponzi. If you bought Apple stock at 15 and sold at 150, where did that 135 $ come from? Not from Apple, but from other ""users"" of that ""game"" who are buying in after you.
BUT, stocks are so widely adopted, so much the part of the world we live in, no one is worried that there will be no new users coming in the space.
Adoption is key. Stepn has a potential for a mainstream adoption because everybody is walking and everybody has a phone in their pocket. But will it happen? I have no idea.";0;2022-05-23 06:11:48;t3_uve7sj;/r/StepN/comments/uve7sj/why_i_dont_care_if_stepn_is_ponzi/i9nkhn0/
42;yonks;The Sneaker burning mechanism was brought up by Co-Founders on a recent STEPN AMA.;0;2022-05-23 05:01:47;t3_uvqxdp;/r/StepN/comments/uvqxdp/whats_the_benefit_of_more_shoes/i9neqfz/
43;costy866;"1. Wifi off
2.resillience 11
3.open app whait 30 sec for gps to connect start to walk after pres Start
4.do 0.5 energy dor 25% extra earning 
5.close all apps, disable apps from using gps location except Stepn";0;2022-05-23 04:14:55;t3_uvkg30;/r/StepN/comments/uvkg30/earning_less_gst_every_day/i9nag9b/
44;artificialimpatience;Were people saying this about axie infinity too?  I’m not sure but it seemed to have a long run and the valuation of the currency is still way higher than stepn..;0;2022-05-23 03:06:44;t3_uve7sj;/r/StepN/comments/uve7sj/why_i_dont_care_if_stepn_is_ponzi/i9n3bps/
45;BoofLord5000;"Bro this is ending in 4 weeks yeah that would be a while if nodody is using Solana but they obviously are.

There are way way more users on the Solana side right now and shoes sales are only going up especially due to the ability to use them for BSC energy.

I don’t even see your point when people are buying tons of sol gst to level up and mint shoes. The Solana shoes marketplace is flying due to BSC. In turn giving StepN more revenue. 

When BSC user base gets on the same level as Solana the prices will even out and a token bridge will be an option. On top of that Solana gst has more exposure to exchanges therefore swings more with market trends.";0;2022-05-23 03:03:53;t3_uvptlj;/r/StepN/comments/uvptlj/sol_gst_is_really_dying/i9n303d/
46;Mindless_Speed_7645;Can also get codes at this STEPn Discord group here. That’s where I got mine. https://discord.gg/emWm9baj;0;2022-05-23 02:54:24;t3_uvlek9;/r/StepN/comments/uvlek9/i_give_code_to_these_who_will_buy_the_sneakers/i9n1xre/
47;Mindless_Speed_7645;Can also get codes at this STEPn Discord group here. That’s where I got mine. https://discord.gg/emWm9baj;0;2022-05-23 02:54:08;t3_uvlm3e;/r/StepN/comments/uvlm3e/activation_code/i9n1wql/
48;Confident-Broccoli86;Someone can finish roi just for 2weeks , bro it's serious they make money from our investment , it's a pyramid, stepn doesn't have other income source , just users' money , I asked them to put AD like YouTube and Google, and make something profitable service but still there is none , see, how Terra knocked off just in few hours, like a snap , it's scary man;0;2022-05-23 02:49:47;t3_uvptlj;/r/StepN/comments/uvptlj/sol_gst_is_really_dying/i9n1ez5/
49;yonks;"You have a lot more opportunity to earn GST per minute and more importantly work on maxing your daily GST income cap.

I personally shifted from my Level 19 Common Runner about 2 weeks ago to a Level 0 Uncommon Runner. It took me several days to get it Leveled up where it made sense to use over my Level 19 Common Runner. When I did make that shift …

- [My 1st +100 GST STEPN run!! (12d ago)](https://www.reddit.com/r/StepN/comments/umsqtl/my_1st_100_gst_stepn_run/)

Now I am currently earning ~145 GST on the same run!!

Next planned upgrades:
- (2) Level 2 Efficiency Gems, replacing the Level 1’s
- Level 3 Luck Gem

I have also been consistently obtaining Level 2 Mystery Boxes and currently have 4 in my Loot Box slots!!";0;2022-05-23 02:34:55;t3_uvo5m1;/r/StepN/comments/uvo5m1/what_would_you_do_when_you_hv_10th_shoes_to/i9mzp28/
50;move2earnphysio;"Click the link for links to all major podcast platforms, or just search STEPN Injury Prevention Podcast in your favourite podcast app or YouTube.

If you would like to ask questions or suggest topics, please let me know.

To get the latest episodes updates and to ask questions, please join https://www.facebook.com/groups/stepninjurypreventiongroup";0;2022-05-23 01:47:28;t3_uvpeun;/r/StepN/comments/uvpeun/crosstraining_cardio_to_improve_your_running/i9mu423/
51;Snoo94719;Haha i think it would be easier for STEPN to provide the conversion that having the country change it!  For real it’s annoying;0;2022-05-23 01:42:33;t3_uv0hm4;/r/StepN/comments/uv0hm4/when_will_stepn_do_mph_va_kph_for_us_in_the_usa/i9mtixh/
52;vicodinchik;No one should buy runners except if they run 300km monthly. Stepn neef either adjust speed ranges or put a big red disclaimer. Unprepared body will eventually get hurt if you have 9 shoes and run 45min every day with 5:00 pace.;0;2022-05-23 01:33:27;t3_uvginu;/r/StepN/comments/uvginu/hey_everyone_i_currently_have_a_level_16_runner/i9mserx/
53;Effective-Tour-656;DaeR stepn hop this find you wel l. You do good app. Me free sneakers! Or give me Sol to by my own;0;2022-05-23 00:56:37;t3_uvm7l7;/r/StepN/comments/uvm7l7/if_you_really_love_this_game/i9mo1js/
54;MisterBluff;whats the best way to get bnb to the stepn wallet? which plattform and what to purchase?;0;2022-05-23 00:47:56;t3_uvlnqd;/r/StepN/comments/uvlnqd/tip_for_beginners/i9mn10t/
55;Creepy-Repeat-2400;Any one use stepn app tell me about;0;2022-05-23 00:09:40;t3_qcknwv;/r/StepN/comments/qcknwv/rstepn_lounge/i9miom0/
56;yonks;"STEPN on BSC requires different sneakers than on Solana as the NFTs are not compatible cross chain. There is more demand for Sneakers than there are people earning GST on BSC resulting in very high GST prices on GSC.

To answer your question about whether now is a good time to buy Sneakers …

If you are looking to get started on Solana … with the recent crypto downturn, SOL is about 50% less than it was last month. The floor prices, in SOL, have remained fairly consistent. This means if you are converting fiat to SOL … you can get your Sneakers for ~50% less than someone a month ago.

Either way … the sooner that you get started, the sooner you can start your journey and ROI. This is a game that rewards consistency.";0;2022-05-22 23:53:12;t3_uvml3c;/r/StepN/comments/uvml3c/guys_there_is_something_i_really_dont_understand/i9mgtpd/
57;rullaz;"100% Scam. (Best tip for you is that, for a seller it shouldn't be an issue if his item is bought by you or a sniper bot. He gets the same.)

And please read this;

[https://www.reddit.com/r/StepN/comments/url4ld/how\_to\_not\_get\_scammed\_how\_to\_be\_careful\_for\_11/](https://www.reddit.com/r/StepN/comments/url4ld/how_to_not_get_scammed_how_to_be_careful_for_11/)";0;2022-05-22 23:44:33;t3_uvg9dp;/r/StepN/comments/uvg9dp/doesnt_want_to_list_to_market_scam/i9mfuby/
58;hosseinkhan123456;"Hello good time  
In the STEPN program, I charged my account to Solna 13 to pay for shoes.  
Sorry, the program was automatically logged out  
And then no matter how hard I tried to login again, I got the error that the password or username was wrong  
Anyway, I logged in again today with the new activation code  
I entered the 12-word Walt password, but it's zero since I deposited 13 SOLNAs into Walt's spanding account.  
The spanding account is also zero  
Total game inventory is zero  
But it shows the history of receiving Solna in Walt.  
Please tell me what to do?  
Thank you";0;2022-05-22 22:33:50;t3_qcknwv;/r/StepN/comments/qcknwv/rstepn_lounge/i9m7m9p/
59;Ark3tech;"The US government would have a problem with that for sure.  You're basically saying people can launder money through the STEPN app, as long as they don't cash out USDC.

As far as I know any gain you make can be taxed, even if you were to swap appreciated ETH to BTC as an example.";0;2022-05-22 22:24:08;t3_uvl3r9;/r/StepN/comments/uvl3r9/does_anyone_know_what_tax_season_will_be_like/i9m6gmq/
60;Ark3tech;"You can't compare all crypto to Terra and just live in constant fear.  Bitcoin has existed for 14 years without one hack.  BTC is solid as a rock, and that would need to fail in order to bring the rest of the crypto market down.

The Terra crash was a black swan event.  Much like bitconnect from the early days. Do Kwan made some major mistakes that people were able to exploit and crash the UST price that was tethered to Terra.

STEPN can crash sure, but I expect to have reached my ROI and then some before that happens. Also, SOL will not remain $50 forever.  This won't be going away for awhile.  We have a whole Summer ahead of us with people jumping in this app.  Prices could still continue to fall in the short term, but that trend will eventually reverse. Also, you're getting paid to walk for a few mins a day.  There are careers that don't pay as much as STEPN does.  I'm in the get in while you still can camp.";0;2022-05-22 22:17:04;t3_uvkvas;/r/StepN/comments/uvkvas/what_do_you_think_sol_below_29dollars/i9m5l1e/
61;AWilfred11;"i just checked im defo not spending 6k on a shoe. especially since id need 8 additional shoes at like 700 each so 11,600 to hit the numbers ur talking about.

Even to get 4 energy thats an 8.8k investment to pay 279$ at the shoe i saw for 21 BNB

I absolutely don't have that much money, STEPN is already by far my largest investment";0;2022-05-22 21:42:35;t3_uvinnc;/r/StepN/comments/uvinnc/im_making_800_a_day_with_9_shoes/i9m1a0m/
62;migrantmoreno;Yes u sure can! But make sure u transfer it to your bnb network address on stepn;0;2022-05-22 21:30:54;t3_uvinnc;/r/StepN/comments/uvinnc/im_making_800_a_day_with_9_shoes/i9lzt49/
63;Becoolol;is it safe to transfare bnb from binance to your stepn account?;0;2022-05-22 21:00:35;t3_uvinnc;/r/StepN/comments/uvinnc/im_making_800_a_day_with_9_shoes/i9lvwgo/
64;kolgamma;Well, Sol is also down about 50% from then. Using a widespread crypto crash as evidence of devaluation in crypto profits for stepn is a bit silly.;0;2022-05-22 20:50:51;t3_uve7sj;/r/StepN/comments/uve7sj/why_i_dont_care_if_stepn_is_ponzi/i9lumif/
65;crypticuser14;does anyone got banned by stepn? if so, for what and will you get any first warning before ban?;0;2022-05-22 20:40:35;t3_qcknwv;/r/StepN/comments/qcknwv/rstepn_lounge/i9lt9yh/
66;Nightmares57;It's not a glitch bro. Stepn devs made it this way and they're (maybe) banning people for the 0,8 glitch not the 0,6, it's 100% safe;0;2022-05-22 19:40:58;t3_uvh17m;/r/StepN/comments/uvh17m/selling_this_shoe_for_2643sol_on_the_market_place/i9llhmz/
