;author;body;controversiality;created;link_id;permalink
638;Plastic-Sound-7186;"64326983

Your welcome, enjoy! Welcome to the Stepn.";0;2022-05-16 01:45:11;t3_uq1rdh;/r/StepN/comments/uq1rdh/2_activation_codes_giveaway_upvote_this_post_will/i8rofjl/
639;Mnemiq;Welcome, if you have any questions just ask. Just passed 100 km and 1 month with stepn. :);0;2022-05-16 00:21:37;t3_uqiv1f;/r/StepN/comments/uqiv1f/golden_ticket/i8rdnay/
640;eltacm;Hi, glad to help. Just send BNBs from BInance to your Stepn BNB wallet after creating BNB wallet in stepn.;0;2022-05-15 23:11:45;t3_ugm2zm;/r/StepN/comments/ugm2zm/falsely_sent_sol_from_binance_to_stepn_bnb_wallet/i8r56jc/
641;macsoft123;Best way to have your STEPN account canceled;0;2022-05-15 22:54:09;t3_uq9tdv;/r/StepN/comments/uq9tdv/selling_codes_for_cheap/i8r30f7/
642;Alexios5552;I sell it now on stepn app;0;2022-05-15 22:29:49;t3_uqh2th;/r/StepN/comments/uqh2th/any_one_want_a_walker/i8qzy7p/
643;yonks;"It has been discussed on previous 2 weekly STEPN AMAs (May 7th &amp; 14th).";0;2022-05-15 22:28:51;t3_uq0o8b;/r/StepN/comments/uq0o8b/i_feel_like_its_not_worth_to_open_mystery_box/i8qztmk/
644;Follovv;Please advise how can i send Solana to Stepn? Binance is congested or suspended.;0;2022-05-15 22:12:16;t3_qcknwv;/r/StepN/comments/qcknwv/rstepn_lounge/i8qxny8/
645;Follovv;"How can I send Solana to my Stepn account?
Binance is congested or sustained.";0;2022-05-15 22:09:36;t3_t687u8;/r/StepN/comments/t687u8/alternative_ways_to_acquire_new_shoes/i8qxaxu/
646;GSB2Moon;Thanks so much this worked for me. I added the Stepn wallet to my trust wallet app. Then once that was added I had to ‘add new token’. In that I added the contract address that you can find on bscscan website entering your txid. Then thankfully it was there;0;2022-05-15 21:09:59;t3_ucq4gp;/r/StepN/comments/ucq4gp/help_accidently_sent_sol_to_bnb_smart_chain_wallet/i8qp4vz/
647;Particular_Pickle798;"Level up you main to 9 then stack GST. 

Next pay day, buy another jogger 0/7 mints, and start minting your way up to 3 pairs (4 energy) then 9 pairs (keep your main to lvl 9, optimal lvl for fast ROI or during minting process). 

Runners are good, but if you can’t run consistently at around 10km/h then you better stick to a Jogger. 

Energy is top priority in STEPN as it unlocks more earnings, more features ( Mystery boxes drop, scroll drops, faster mints).";0;2022-05-15 21:02:14;t3_uqe2rj;/r/StepN/comments/uqe2rj/bought_my_first_jogger_for_17_sol/i8qo2cq/
648;BigD4yoMind;Did you immediately start walking after using the energy.I just took my first. Walk on Stepn also. I made 2.4 gst. And I think I could've got more if I knew that each energy spent last 5 mins of walk/jog/run. But once you start spending the energy. It only last 5 mins.;0;2022-05-15 20:57:18;t3_uqeypf;/r/StepN/comments/uqeypf/i_took_my_first_run_and_stepn_didnt_give_me_any/i8qndss/
649;Particular_Pickle798;"Too much ressources for the lowest rarity tier. 

Generally speaking, you should always aim at more energy (if you play long term, for maximum earnings, gems drops, scrolls…) instead of leveling your common to let’s say 28. Meaning you will mint a lot. 

If you mint consistently you will eventually drop an UC. Most people with 9 ~ 12 energy also buy an UC, since they can afford one after roughly after 2 ~ 3 weeks of earnings. 
It is kind of the natural next step when getting to a certain point. So it is just not worth the ressources to get passed lvl 19. 

Of course, if your goal is to have 4 energy, and just cash out (which I would not recommend, for the sake of the sustainability of STEPN, and for your sake as you will miss out on many aspect of the game) then you should lvl it up to 28 as it will give you more tokens per run.";0;2022-05-15 20:46:45;t3_uq7k4h;/r/StepN/comments/uq7k4h/which_slots_for_gems_r_better_eeee_or_eeer_please/i8qlw5u/
650;Fair-Pool-5155;"Looks like you are a ++STEPN knowledge. May I kindly ask if levelling up from 19 to 20 is worth it. 60GST+60GMT is 90GST equivalent. I have EFF60 &amp; RES24. If the level up delivers +1GST it will take 3months to get that “investment back”. Are there any other GST booster(s) justifying the expense to upgrade to Lv20";0;2022-05-15 20:46:05;t3_uqcoj3;/r/StepN/comments/uqcoj3/does_one_uncommon_sneaker_have_2_energy_or_21_3/i8qlsua/
651;Snoo28247;I just downloaded Stepn, if anyone has a complimentary activation code I would appreciate it;0;2022-05-15 20:28:16;t3_qcknwv;/r/StepN/comments/qcknwv/rstepn_lounge/i8qjbui/
652;TBone_not_Koko;No, stepn is not open source. There are release notes available on their website.;0;2022-05-15 20:13:16;t3_uqdg8v;/r/StepN/comments/uqdg8v/questions_source_code_release_notes/i8qhaiw/
653;SnooDoughnuts7714;Going to report you at stepn and wherever I can. I hope you will lose it all;0;2022-05-15 20:08:17;t3_upwsl6;/r/StepN/comments/upwsl6/selling_stepn_code_for_cheap_message_me_if_you/i8qgmgi/
654;HotExpert0;If there are not a lot of shoes, the price of the shoe will rise exponentially, so none will buy them. Stepn tries to stabilize the prices through different mechanics such as double minting which increases overall existing shoes;0;2022-05-15 20:00:08;t3_uqe3ir;/r/StepN/comments/uqe3ir/hey_how_is_it_when_selling_the_shoe_is_it_a/i8qfi5g/
655;HauntingBeautiful906;Transferred money from STEPn wallet to STEPN spending. Using solana network.;0;2022-05-15 19:57:23;t3_uq9uko;/r/StepN/comments/uq9uko/sol_lost_during_transferring_funds_from_wallet_to/i8qf4mr/
656;nikamtskhetadze;But the most accurate is still trough the stepn app;0;2022-05-15 19:06:20;t3_uqcn6u;/r/StepN/comments/uqcn6u/does_anyone_know_how_much_1_gst_is_worth_thanks/i8q89sc/
657;Consistent_Exam8128;I want a code for stepn app;0;2022-05-15 18:45:05;t3_qcknwv;/r/StepN/comments/qcknwv/rstepn_lounge/i8q5eeh/
658;Fine_distinction;These are good questions. I think they have not thought the rental system through yet, it seems that the owners assume all risks - including renters not using shoe, costs, fees - for just 70% of income - and keeping mystery boxes, which is actually likely to cost you, lol. So does not seem to make much sense from owners perspective, especially for good shoes. Of course makes ton of sense from the StepN point of view, the reason they propose 1 day up to 7 days max rentals is prolly to have extra fees from transferring shoes back and forth etc. Renters will only risk their rating which is not much/anything  in the beginning, they can always start a new account ...;0;2022-05-15 18:44:47;t3_uq8ndr;/r/StepN/comments/uq8ndr/in_the_future_why_would_anyone_rent_a_common/i8q5cyk/
659;Fine_distinction;stepn guide is not accurate for repair cost, for me also for earnings;0;2022-05-15 18:32:13;t3_uqad8b;/r/StepN/comments/uqad8b/optimum_resiliency_level_for_4_energy_walks_are/i8q3nnj/
660;Farazs97;I want stepn code man;0;2022-05-15 18:20:00;t3_uq9141;/r/StepN/comments/uq9141/h_1x_activation_code_w_someone_who_will_really/i8q20ka/
661;Ok-Bandicoot7174;"I have the same problem, I do not think it was hacked though.
I went to sleep and next day all my 3 sneakers are gone. Plus a few GST gone and a little left. My Wallet in untouched.
I checked the email, verification codes were automatically forwarded to trash but there was no verification code sent, except those that I was sending.
Wrote to support almost 3 days have gone and nothing yet, they are flooded with tickets, hope will respond to this problem soon.
I am long time in crypto and very cautious. I have 2fa on everything, VPN and all sorts of security measures. Most of Stepn users are new to the space, they know nothing about security (at least its true in my Country). If they hacked me, Stepn society is in huge trouble, because this app in not safe at all.";0;2022-05-15 18:07:16;t3_ul56zi;/r/StepN/comments/ul56zi/stepn_account_hacked/i8q09ec/
662;Lovablecurves;Flowell is better it’s like stepn on steroids;0;2022-05-15 18:06:44;t3_uplh1f;/r/StepN/comments/uplh1f/my_gf_just_opened_this_at_her_first_mint_vs_me/i8q06oy/
663;WhySoJelly;"Try googling ""Stepn White Paper""";0;2022-05-15 17:46:37;t3_uq2f47;/r/StepN/comments/uq2f47/so_how_is_this_not_a_ponzi_that_will_collapse_on/i8pxfo1/
664;surnov;"Nice ! I'm gonna give a try at stepn :)  
Someone got an activation code to share ?";0;2022-05-15 17:31:16;t3_uq1d2f;/r/StepN/comments/uq1d2f/first_mint_first_badboy/i8pvaiy/
665;Azhar_Mallick;Quick question. Can I exchange the gst or gme coins to solana on the Stepn app itself?;0;2022-05-15 16:51:49;t3_uq9bb6;/r/StepN/comments/uq9bb6/hi_i_am_in_canada_what_broker_should_i_use_to_buy/i8pptom/
666;Snoo28247;I just downloaded Stepn, can I get an Activation code please?;0;2022-05-15 16:20:55;t3_qcknwv;/r/StepN/comments/qcknwv/rstepn_lounge/i8plij4/
667;North-Ad-7686;"It doesn't really have million users already. They said that since day one. These images are most likely shopped and they haven't even started working on an app. The staking is most likely a quick rug. The reason you shared the link is because it's referral for you.

Even if every point I made above would be proven false later, it doesn't change the fact that this is a disgusting rip off of STEPN. You should be ashamed to promote it.";0;2022-05-15 16:14:53;t3_uq2wzu;/r/StepN/comments/uq2wzu/stepapp_app_like_stepn_is_launching_in_4_days_it/i8pknvo/
668;Font_Fetish;"Some writings from the team behind Stepn that you may find helpful:

https://stepnofficial.medium.com/are-all-play-to-earn-games-ponzi-a2ddcc31db29

https://stepnofficial.medium.com/tokeonomics-at-stepn-ee08604e82f1";0;2022-05-15 15:53:39;t3_uq2f47;/r/StepN/comments/uq2f47/so_how_is_this_not_a_ponzi_that_will_collapse_on/i8phqbk/
669;artificialimpatience;"1. I just run Garmin on my watch and stepn separately.   I joined the Strava stepn group and my Garmin pushes the results to Strava and is added into the stepn group. 

2. Good question - probably depends on your phone and whether the gps is on during airplane mode";0;2022-05-15 15:47:00;t3_uq7jjb;/r/StepN/comments/uq7jjb/questions_about_activities/i8pgtmv/
670;yoyo9393;hi I'm newbie. I sent solana from spending account to Stepn wallet. It has been an hour and still not received. Also my Solscan doesn't show. Did it just disappear???;0;2022-05-15 15:25:31;t3_qcknwv;/r/StepN/comments/qcknwv/rstepn_lounge/i8pdy0j/
671;LucyLove980;This is an ok time to buy, the sneakers are cheap compared to a couple of weeks ago. Read the stepn whitepaper for more information about the game, i can also invite you to the stepn discord if you want. Best place to get updates😊;0;2022-05-15 15:12:56;t3_qcknwv;/r/StepN/comments/qcknwv/rstepn_lounge/i8pcacr/
672;MarkusXX01;"Hey hey. Is there currently a other way to get shoes besides buying them directly? 13-14 SOL is a huge amount of money in my opinion. I am very new to StepN / Crypto. 

Have a nice day y'all!";0;2022-05-15 14:32:33;t3_qcknwv;/r/StepN/comments/qcknwv/rstepn_lounge/i8p6z8e/
673;Particular_Pickle798;"Hmm the 3/7 mints is not ideal.. but I would first level it up to lvl 9. It is the most optimal lvl for ROI or earn to buy next pair (above that it costs too much ressources at your state)

The only option really, if your goal is to mint more to get more energy and play long term, is to earn, buy a 0/7 mint. Then earn again, buy another 0/7 to finally be able to mint… it will take time but you should be alright. 

In STEPN having more energy should be the priority. It gives you chances for gems, scrolls (next update), and much more earnings then a lvled max shoe with less energy.";0;2022-05-15 14:24:40;t3_uq4u0v;/r/StepN/comments/uq4u0v/level_up_or_save_to_buy_shoes/i8p5yv2/
674;AnarchicKamalist_1;Buy a level 5 jogger or runner (if you can run for 350 meters) with good stats and also buy some gst (15-20) to level it up to 9 faster. Make resilience 11 and give other points to efficiency. Jog or run 4 times in a day to increase your gst earning (+%20 with 0.6 energy trick) and decrease your durability loss, dont use stepn guide, this info is best for fast ROI and it is approximately 1 month if prices dont go down too much.;0;2022-05-15 14:05:10;t3_uq2f47;/r/StepN/comments/uq2f47/so_how_is_this_not_a_ponzi_that_will_collapse_on/i8p3j6p/
675;caverson;"The way I see it is, I compare this to mobile games that incentivise investment into the games currency. In those games the whales will investment money to do things quickly and those profits go to the owners/developers (usually the whales will be like 5% of the players but will account for like 80% of the investment or some bullshit). In this case a decent portion goes back to the players who can choose to reinvest (burning/reducing the supply) or cash out.

When it comes to it being a Ponzi scheme I don't think people actually know what a Ponzi scheme is and just say the word cause the game seems to good to be true (it somewhat is). The game only collapses when people stop playing so it's up to the Stepn team to keep the game enjoyable.";0;2022-05-15 13:08:07;t3_uq2f47;/r/StepN/comments/uq2f47/so_how_is_this_not_a_ponzi_that_will_collapse_on/i8owyii/
676;mushicoin;Bellaaaaaa figata sto stepn vero?;0;2022-05-15 12:19:04;t3_uq3hlw;/r/StepN/comments/uq3hlw/from_with_code/i8orymt/
677;Svieris;"Stepn Web Support. 
Send a Dm";0;2022-05-15 12:17:18;t3_uq3dwk;/r/StepN/comments/uq3dwk/help_me/i8orsmx/
678;Jabir_Ibn_Hayyan;I think your are right depending on the price it is not worth it but should we not forget that STEPN is also a gambling game? You have probability to drop one to three gems as well as opening a common shoebox and getting an uncommon shoe.;0;2022-05-15 12:06:08;t3_uq0o8b;/r/StepN/comments/uq0o8b/i_feel_like_its_not_worth_to_open_mystery_box/i8oqrod/
679;AdamFonsten;"Anyone else sold trainers on Stepn and only received two thirds of the money?

I understand that there are fees but I sold for 16sol and only received 11.65

Any ideas";0;2022-05-15 12:05:36;t3_uq4nt2;/r/StepN/comments/uq4nt2/selling_runners/i8oqpu4/
680;Jay-r-dan;That would be my choice if I had SOL available - if you need to sell a sneaker to get SOL than no, because you pay 6% selling fee (unless it pays of with 1 less day of cool-down - lots of math going on in STEPN :p );0;2022-05-15 11:45:14;t3_uq3i9f;/r/StepN/comments/uq3i9f/can_you_transfer_solana_from_one_stepn_wallet_to/i8oov2k/
681;macsoft123;We’ll guys, it seams that the cranks at centralized STEPN move fast. Only 3 days after this fast ROI post, STEPN changed the rules so you can’t use it no more. Until yesterday, with my 43 EFF - 6 RES shoe, I would get 13 GST per run, and spend 2.46 GST fixing it. Guess how much do I have to spent for repairing my shoe now… more than 23 GST!! that’s it, STEPN has changed the rules mid game so I now have to spent twice what I earned to get my shoe repaired!! “Getting money from our game?! No you shall not!!” 🤦🏻 RIP STEPN.;0;2022-05-15 11:32:49;t3_una1ru;/r/StepN/comments/una1ru/got_my_only_shoe_14_days_ago_got_roi_today/i8ont6o/
682;macsoft123;We’ll guys, it seams that the cranks at centralized STEPN move fast. Only 3 days after this fast ROI post, STEPN changed the rules so you can’t use it no more. Until yesterday, with my 43 EFF - 6 RES shoe, I would get 13 GST per run, and spend 2.46 GST fixing it. Guess how much do I have to spent for repairing my shoe now… more than 23 GST!! that’s it, STEPN has changed the rules mid game so I now have to spent twice what I earned to get my shoe repaired!! “Getting money from our game?! No you shall not!!” 🤦🏻 RIP STEPN.;0;2022-05-15 11:32:03;t3_una1ru;/r/StepN/comments/una1ru/got_my_only_shoe_14_days_ago_got_roi_today/i8onqxl/
683;LearnDifferenceBot;"&gt; longer then STEPN

*than

 *Learn the difference [here](https://www.merriam-webster.com/words-at-play/when-to-use-then-and-than#:~:text=Than%20is%20used%20in%20comparisons,the%20then%2Dgovernor%22).*
*** 
 ^(Greetings, I am a language corrector bot. To make me ignore further mistakes from you in the future, reply `!optout` to this comment.)";0;2022-05-15 10:54:17;t3_uq2wzu;/r/StepN/comments/uq2wzu/stepapp_app_like_stepn_is_launching_in_4_days_it/i8oktno/
684;elite_domo;"It’s preferable to transfer from coin 
base to Stepn wallet";0;2022-05-15 10:53:08;t3_uq30lu;/r/StepN/comments/uq30lu/from_where_send_sol_to_the_stepn_app/i8okqpb/
685;steveqwerty61;Fitfi isn’t dodgy they have had a health and fitness app for years a lot longer then STEPN has been around they are just trying to incorporate tokenomics into it.;0;2022-05-15 10:51:50;t3_uq2wzu;/r/StepN/comments/uq2wzu/stepapp_app_like_stepn_is_launching_in_4_days_it/i8oknc4/
686;resutidder24;"I had a similar issue where I wasn't earning GST when my iPhone screen was off during a walk. Check the permissions in her phone settings and make sure Stepn has permission to access location ""always"" rather than only ""while using the app"". That worked for me but not sure if your wife's issue is something different";0;2022-05-15 10:02:13;t3_upzy0l;/r/StepN/comments/upzy0l/how_new_of_an_iphone_do_you_need_for_stepn/i8oh495/
687;Bobbyjames88;"15870954 enjoy &amp; keep StepN 🔥😎";0;2022-05-15 09:41:03;t3_qcknwv;/r/StepN/comments/qcknwv/rstepn_lounge/i8ofnvq/
688;Bobbyjames88;Thanks for all the advice! Keep on Stepn everyone 🔥;0;2022-05-15 09:38:48;t3_uptany;/r/StepN/comments/uptany/the_more_you_run_the_more_important_your_recovery/i8ofi4k/
689;AdCommercial3243;Hello my friends, where can I get the active  stepn code?;0;2022-05-15 09:34:15;t3_upd837;/r/StepN/comments/upd837/who_needs_a_code/i8of6va/
690;Sadazi;"
////#3 luck and gem can make stepn way more fun and it's not working properly right now///
Like . A chance of getting extra energy.";0;2022-05-15 09:08:18;t3_uq0o8b;/r/StepN/comments/uq0o8b/i_feel_like_its_not_worth_to_open_mystery_box/i8ode8g/
691;Forsaken_Shopping902;"Hmmm stepn is not a gamble.

And you clearly didn't understand my point.

If you are a logical person would you invest in a negative expected return over a positive expected return?

At this point, luck is a meaningless stat that Stepn created.

**That is why a Comfort gem is more expensive than a luck gem.**

&amp;#x200B;

If luck is solely created for a gamble . Luck shouldn't be a stat. 

&amp;#x200B;

If you still don't get it. I would like to ask a question.  

Have you found anyone who investing in luck stat to get a mystery box? I assume no because it is better to invest in efficiency and resilience.

&amp;#x200B;

If your concept is right(luck is a gamble that returns a negative expected return) Stepn spent a meaningless hour on a luck system because logical person would not choose over a positive expected return over a negative expected return.";0;2022-05-15 08:50:14;t3_uq0o8b;/r/StepN/comments/uq0o8b/i_feel_like_its_not_worth_to_open_mystery_box/i8oc4lq/
692;Forsaken_Shopping902;"Dude it’s not a gamble. If it is then why would they create efficiency and gst gmt eco system. 

Stepn suppose to be a great ecosystem. I am saying that luck is a meaningless system under this circumstance.

If you are a logical person why would u invest on luck not effi or resilience. If you are right(luck is gamble that expected return is negative) and under the believe that people can think logically, stepn team spent hours on meaningless system";0;2022-05-15 08:12:48;t3_uq0o8b;/r/StepN/comments/uq0o8b/i_feel_like_its_not_worth_to_open_mystery_box/i8o9ijk/
693;HeroEmperror_IBsL;"I hope Someone with too many Sneakers can Share us so we can also start enjoying StepN.
A cheap one is fine for me. 
Since the cheapest on the market is worth 6 to 8 months Salary in out Country the Philippines.
Thank you for the kind heart who likes to share his blessings. 
I promise I will Pay it Forward to others in need as well once I also gain extra sneakers to those who also wished to enjoy StepN who had none to start with.";0;2022-05-15 07:56:49;t3_upd837;/r/StepN/comments/upd837/who_needs_a_code/i8o8dok/
694;HeroEmperror_IBsL;"My StepN SOL address 

Ci7zx8gBvnrN7QCqUJZro36jPy2yYk91QrfoAb5Bf6eg";0;2022-05-15 07:52:53;t3_upd837;/r/StepN/comments/upd837/who_needs_a_code/i8o83u1/
695;HeroEmperror_IBsL;"My StepN BNB address 

0x27f212c4248fd723683a132d2b4638b82036a999";0;2022-05-15 07:52:16;t3_upd837;/r/StepN/comments/upd837/who_needs_a_code/i8o82b4/
696;Worldly-Candidate375;"10 to 13 have the same ratio of 2.5 durability per energy. It means 1.5 durability per 0.6 run. In my experience it always rounded up to 2.
14 to 21 are 2 durability per energy --&gt; 1.2 per 0.6 rounded down to 1.

Anyway if you are aleeady at 10 you should either stay there or go full in up to 14. There are no advantages in between (from my experience and stepn guide)

Hope this helps !";0;2022-05-15 06:56:52;t3_upwrm7;/r/StepN/comments/upwrm7/11_resilience_vs_10_resilience_better_for_split/i8o438o/
697;whiteyfang;That last statement....my friend who shared this stepn app with me also said the same, repeatedly.;0;2022-05-15 04:46:12;t3_upksju;/r/StepN/comments/upksju/it_is_a_good_time_to_buy_sol_in_order_to_have_3/i8nthr0/
698;yonks;"In a short answer … “no”.

Solana doesn’t have a native Stablecoin on its blockchain which is why STEPN has USDC within the app which is a multi-chain stablecoin.

As you have seen this last week … crypto can be very volatile. There was a large decline in traditional equity markets as well though.

A good rule of thumb with crypto … don’t invest that which you are not willing to lose.";0;2022-05-15 04:30:55;t3_upksju;/r/StepN/comments/upksju/it_is_a_good_time_to_buy_sol_in_order_to_have_3/i8ns13m/
699;Similar-Hunter5585;Guys who use binance to move sol to stepn wallet this last 72h;0;2022-05-15 04:09:23;t3_qcknwv;/r/StepN/comments/qcknwv/rstepn_lounge/i8npy5h/
700;Frequent_Push_4670;Difference (by stepn guide) is 17gst daily on level 28 and 14.5gst on level 19 so probably it is the best to stay on 19.;0;2022-05-15 04:06:29;t3_upvs9i;/r/StepN/comments/upvs9i/what_do_you_think_of_this_shoe_wanted_to_level_it/i8npnuj/
701;ngaoda69;Dont buy code from these clowns. Go to stepn discord server, they are giving out codes every 15 minutes;0;2022-05-15 04:04:22;t3_upw3ag;/r/StepN/comments/upw3ag/code_sale/i8npfyz/
702;hollaattonytone;You can look up the transaction on solscan. But are you sure it's not in your wallet? The wallet and the inventory are separate in stepn.;0;2022-05-15 03:08:29;t3_uoycm9;/r/StepN/comments/uoycm9/how_to_transfer_nft_from_phantom_to_stepn_app/i8njog3/
703;Freewash007;Wow! Great feedback. Much appreciated. Helps to know how others see things. I bought uncommon lvl 9 and 2 common lvl zero. Average 31 GST after repair. I absolutely love STEPN .;0;2022-05-15 02:59:25;t3_uoo4p4;/r/StepN/comments/uoo4p4/does_anyone_know_how_much_gst_it_costs_to_level_a/i8nioz5/
704;kostya770;https://dc.stepn.run/invite/s2?code=16524945635081 get one from official STEPN discord. New codes released every 15 min;0;2022-05-15 02:58:19;t3_upvgll;/r/StepN/comments/upvgll/can_someone_please_send_me_a_code_ive_been/i8nikr6/
705;Bobbyjames88;Awesome mate! 🔥I could benefit from some extra knowledge on this. Started StepN 4 weeks and have not taken a day off 👀 can feel the front calves/shin sometimes starting to hurt. I was thinking do I run too much too the front with my weight on my toes instead of heels?;0;2022-05-15 02:02:01;t3_uptany;/r/StepN/comments/uptany/the_more_you_run_the_more_important_your_recovery/i8nc97o/
706;Btro317;This is exactly what I did.. but it’s been 4 days now and my shoe still isn’t in my StepN SOL wallet. I hope it’s not lost forever..;0;2022-05-15 01:28:31;t3_uoycm9;/r/StepN/comments/uoycm9/how_to_transfer_nft_from_phantom_to_stepn_app/i8n8d8l/
707;jdg401;Yes. Had to attempt transfer from CB to STEPN 4-5 times yesterday. SOL network issues;0;2022-05-15 00:55:29;t3_upt90m;/r/StepN/comments/upt90m/sol_transfer_from_outside_to_stepn_wallet_cant_be/i8n4kmj/
708;knockouts_page;They have no business controlling where you send your earnings as you use 2 phone with 2 different stepn acounts. Me and my wife have 2 stepn accounts but sending our earning on the same binance account.;0;2022-05-14 23:35:40;t3_upsr6w;/r/StepN/comments/upsr6w/for_people_who_own_2_account_two_different_devices/i8mv1bu/
709;Spirited-Ad1234;"Hi,
Did you guys get the solution . Still the solana network is congusted in binance . How to transfer solana from binance to stepn";0;2022-05-14 23:28:29;t3_ufzp6e;/r/StepN/comments/ufzp6e/how_to_transfer_solana_to_stepn_without_waiting/i8mu4rl/
710;maschinenbauur;can someone share me stepn code pls?;0;2022-05-14 22:11:15;t3_upqomd;/r/StepN/comments/upqomd/can_someone_share_code/i8mk7y3/
711;T-LionHeart;u ready for stepn;0;2022-05-14 22:09:41;t3_upra2g;/r/StepN/comments/upra2g/i_need_1_activation_code_please/i8mk0xk/
712;PaleontologistFar676;stepn code is my dream plssssss;0;2022-05-14 21:51:27;t3_upd837;/r/StepN/comments/upd837/who_needs_a_code/i8mhohz/
713;feelinggood28;code for person who wanna use stepn app;0;2022-05-14 21:44:52;t3_qcknwv;/r/StepN/comments/qcknwv/rstepn_lounge/i8mgu55/
714;Bitlon_sea;Have you contacted stepn?;0;2022-05-14 21:00:18;t3_upopwb;/r/StepN/comments/upopwb/hi_i_have_transfered_a_sneaker_from_wallet_to/i8mb10t/
715;jdg401;The network was having issues yesterday. If it doesn’t post in a few minutes, it likely failed and you should see your CB balance back to pre-transfer level. If so, just try again until it works. Probably took me 4-5 attempts to finally get my SOL over to STEPN yesterday.;0;2022-05-14 20:40:56;t3_upkjhf;/r/StepN/comments/upkjhf/transaction_error_from_stepn_to_coinbase/i8m8iqx/
716;epicgameing;Bro just tell me what I’m dealing with rn(the Stepn) it’s just an EDP445 pic nothing else.;0;2022-05-14 20:30:25;t3_upodxu;/r/StepN/comments/upodxu/i_didnt_get_any_gst_from_my_walk_today_it_showed/i8m75s9/
