;author;body;controversiality;created;link_id;permalink
1345;Intrane;"Did same mistake. Only way out so far is sending support ticket and waiting for their reply, did same mistake weeks ago and still no reply 
It’s nerveraking, since I’m in Ukraine, and who knows how long our business will hold up, so was expecting STEPN to create passive income and now we got all market going down

After that I’ve took some savings and purchased 2 sneakers, so far it’s going decent, but hoping for the best to come";0;2022-05-10 11:34:36;t3_umdqhg;/r/StepN/comments/umdqhg/sent_sol_to_bnb_wallet_how_do_i_recover/i81e9td/
1346;AzdakGabo;if you dont want to wait, nevertheless, its yr additional problem. wait! problem will get solved. chill and dont worry. a lot of experience is here that stepn team helped people.;0;2022-05-10 11:31:56;t3_umf70p;/r/StepN/comments/umf70p/delay_in_transfer_from_wallet_to_spending/i81e0dv/
1347;goodday391;Hi:) i have code, dm me if you really need it and want to use stepn app);0;2022-05-10 10:22:08;t3_qcknwv;/r/StepN/comments/qcknwv/rstepn_lounge/i8184oh/
1348;Alroyloggins;Yep, I sent Sol to my Stepn BNB wallet address address on the BNB smart chain network so it never arrived. Managed to recover it via trust wallet and adding a custom token about half an hour ago;0;2022-05-10 10:13:58;t3_umdqhg;/r/StepN/comments/umdqhg/sent_sol_to_bnb_wallet_how_do_i_recover/i817i4y/
1349;New_Chest4318;"thanks scoobysi, I'm a heavy stepn guide user myself

but it does not show how much durability damage I will get if I split my runs, it only shows how much durability will be damaged if I run for 3 energy during ONE run

by my calculations, one 0.8 run with 18 resilience will cost me 1.33 durability. But the question is -- will it round to 1 or 2?";0;2022-05-10 09:47:51;t3_umevb4;/r/StepN/comments/umevb4/uncommon_resilience_for_4_walks_per_day/i815m4s/
1350;punkybumpkins;You must have a BNB chain wallet setup on stepn? Did u check that chain is active?;0;2022-05-10 09:37:13;t3_umdqhg;/r/StepN/comments/umdqhg/sent_sol_to_bnb_wallet_how_do_i_recover/i814vnt/
1351;Still_Not-Sure;"What is Bitcoin’s utility… It is not a utility coin…. and don’t say it’s money,  it is just that because a bunch of financial institutions accept it now.. That is how Paper money notes became a thing… there was gold and silver blah blah, then someone starting writing notes and shit with numbers to make it look official..

Ponzi scheme is a scheme where first investors get paid out by incoming investors and so on and so forth…. That is not what is happening with Stepn, not really.. Solana and GST were established before this project.. so the money was already there technically. 

All of crypto is technically a ponzi scheme… and a lot of it is,  the right pulls that happen all the time along with the pump and dumps … it happens even with bitcoin… right now everyone is selling.  anyone with money is buying up small increments daily

Inflation is bullshit, also a created concept.. The only realistic inflation rhat should happen is a person works long in an industry so he gets a raise, hence his boss should raise prices on the goods he produces… other types of inflation… could result from having to find a different coal mine… that would cost the company money and moving equipment paying research and development.. etc…. 

what we have now is bullshit standardized inflation created by shitty industries that keep control of emerging industries like for instance Solar and crypto(these are various fields but they are taking on oil industry and financial industry respectively)";0;2022-05-10 09:29:33;t3_um7hq1;/r/StepN/comments/um7hq1/how_long_until_this_clear_ponzi_collapses/i814d34/
1352;HotExpert0;"If you spend 5 consecutive days and level your shoe up to 9 you will break even to about 2 weeks less
Use the stepn guide calculator and do the math
Regardless of whether you level up or not i would advise you to stack gst until the market comes up and gst price rises";0;2022-05-10 09:29:15;t3_umees8;/r/StepN/comments/umees8/need_advice_leveling_up/i814ccm/
1353;Rishi_Nayak;serious users who want to be part of stepn don't wait for weeks to get one code;0;2022-05-10 09:25:19;t3_qcknwv;/r/StepN/comments/qcknwv/rstepn_lounge/i8142re/
1354;Rishi_Nayak;and also a perfect time to get started with stepn. you will earn about $40 a day🌝;0;2022-05-10 09:12:31;t3_qcknwv;/r/StepN/comments/qcknwv/rstepn_lounge/i8137ec/
1355;Historical-Ad1758;"Stepn need take prices down in marktplace 
Like all the markets";0;2022-05-10 08:55:54;t3_umd8de;/r/StepN/comments/umd8de/stop_being_pessimistic_spreading_those_vibes_in/i81235f/
1356;Davis-1140;Look in your email that’s associated with your account and see if u had any stepn email activation codes sent to you that u didn’t request;0;2022-05-10 08:28:24;t3_umdel7;/r/StepN/comments/umdel7/my_jogger_disappeared/i8108w6/
1357;Urbasm;No problem bud… I did the same… but the first asshole told me this isn’t the place for Stepn talk and speculations and I should go read the whitepaper… Sooo boring;0;2022-05-10 07:55:16;t3_ui5dva;/r/StepN/comments/ui5dva/600600_common_jogger/i80y0i2/
1358;Far_Passage_1459;When entry is too low devs cannot control the influx of new player thus can ruin their pools when a bunch of newbies want to cash out at once, which is why Stepn only allows new players by an activation code which helps keep new payers joining balanced which is also a key difference from other move to earn that you should keep in mind 😉;0;2022-05-10 07:54:18;t3_ujqfd7;/r/StepN/comments/ujqfd7/stop_selling_gst_at_low_price/i80xy45/
1359;captchu;Very well said. Stepn is here to stay.;0;2022-05-10 07:40:25;t3_umapuh;/r/StepN/comments/umapuh/plan_for_the_worst_hope_for_the_best/i80wzz2/
1360;Frequent-Eagle-4728;I have the same problem.  My gmail account is protected with 2FA.  My gmail account was definitely not hacked.  I got a verification code from stepn 15 times in a row.  I immediately entered the account with my own password and there were no shoes.  We must definitely act together.  Our money is gone.;0;2022-05-10 07:25:51;t3_ul56zi;/r/StepN/comments/ul56zi/stepn_account_hacked/i80vzpc/
1361;Effective-Tour-656;I'm glad I've pulled through this in positives, mostly because of my stake in Stepn crypto.;0;2022-05-10 06:51:08;t3_umc0zr;/r/StepN/comments/umc0zr/gst_price_action/i80tg71/
1362;yonks;You will not receive support from STEPN here. I would recommend to create a ticket on STEPN discord server;0;2022-05-10 06:16:49;t3_umbv8v;/r/StepN/comments/umbv8v/shoes_are_missing_help/i80qrbh/
1363;yonks;"We are not officially in a bear market yet (based upon S&amp;P 500)

&gt; *The S&amp;P 500 looks like it can fall into bear market territory.*

Source: https://www.barrons.com/articles/sp500-bear-market-apple-51652120401?tesla=y

Either way … I’m still bullish long term on STEPN and will keep earning GST and building my NFT Digital Sneaker empire!!";0;2022-05-10 05:36:27;t3_umapuh;/r/StepN/comments/umapuh/plan_for_the_worst_hope_for_the_best/i80ndbw/
1364;Jabir_Ibn_Hayyan;Definitely a good time to start the STEPN journey as price for SOL GST and GMT are low you can buy sneakers and mint with discount. You gently collect token by jogging and with patience price will go up and your ROI will be there.;0;2022-05-10 05:23:19;t3_uma4fq;/r/StepN/comments/uma4fq/is_it_a_good_time_to_buy_a_sneaker_for_newcomers/i80m7i5/
1365;Equal_Ad1759;Stepn executes the trades on Orca, chill;0;2022-05-10 05:12:54;t3_um8ufh;/r/StepN/comments/um8ufh/bullshit_conversion_rates_in_stepn_trade_function/i80l9th/
1366;chesterStepn4;"Hi mates Got STEPN codes available follow to
get yours";0;2022-05-10 04:50:08;t3_qcknwv;/r/StepN/comments/qcknwv/rstepn_lounge/i80j484/
1367;goonsquadd69;GST from spending wallet to storage on stepn app. Then trade it for SOL on stepn app. Then send that SOL to Kraken.  Seemless;0;2022-05-10 04:22:54;t3_u2uhck;/r/StepN/comments/u2uhck/how_do_you_cash_out_on_stepn_i_tried_to_send/i80g7tp/
1368;mihai3221;Giving away 2 code free per day STEPN activation codes follow and message if you want them;0;2022-05-10 04:20:50;t3_uln2be;/r/StepN/comments/uln2be/get_activation_code_right_now/i80g09c/
1369;Still_Not-Sure;"why would you post this?

Money is a Ponzi scheme…

Bitcoin is a ponzi acheme

stepn is a ponzi scheme…. what is";0;2022-05-10 04:15:36;t3_um7hq1;/r/StepN/comments/um7hq1/how_long_until_this_clear_ponzi_collapses/i80ffgx/
1370;yonks;"15-17 Luck with 5 Energy Spent during a 125% Energy Strategy (3 Sneakers) is where you start getting Level 1 Mystery Boxes.

Be aware that with current market dynamics that these Level 1 Mystery Boxes, which cost 9 GST to open are not really worth it for what you receive (typically 1 Level 1 gem).

The more Energy that you use in a single StepN run, the less Luck you need.

I personally wouldn’t recommend someone to consider thinking about Luck until they have 9 Sneakers.";0;2022-05-10 03:36:49;t3_um97hh;/r/StepN/comments/um97hh/luck/i80b23d/
1371;hearsdemons;"Sometimes the app is buggy or glitchy, or not up to date. Just to check it’s updated with the latest price, I first start with a quick check of what 1 gst is worth in USDC in the Stepn trade conversion. Then what 1 gmt is worth against USDC. 

Right now, it shows 1 gst is worth 3.41 USDC, and 1 gmt is worth 1.82 USDC. So that’s 1.82 / 3.41 or 0.53. Now if I put 1 gst and convert it to gmt, I get 1.86 GMT for 1 gst. And this conversion 1 / 1.86 is also 0.53.";0;2022-05-10 03:26:42;t3_um8ufh;/r/StepN/comments/um8ufh/bullshit_conversion_rates_in_stepn_trade_function/i809vzh/
1372;frafoa;Likewise, as a part-time running coach, I run at least 9 miles every day. STEPN has been a really good companion but I'd put the miles in anyway.;0;2022-05-10 03:14:46;t3_um67q3;/r/StepN/comments/um67q3/gmt_and_gst_falling_dramaticallythoughts_as_to_why/i808h6b/
1373;Submersed;"You shouldn't expect to break even (what you actually mean is PROFITING 100%) on any investment in a month, even if the current projections show that. 

It makes sense that the project would start out with very high yields that slowly subside. What STEPN is trying to avoid is a mass overnight crash that collapses the system. They have done a lot of things thus far to prevent this from happening.";0;2022-05-10 03:07:23;t3_ulpo6h;/r/StepN/comments/ulpo6h/the_whole_crypto_market_is_down_relax/i807l3q/
1374;goonsquadd69;Yeah it’s only at level 10 and 20 that you get charged a larger sum.  If you google “stepn level up cost” you can find a chart showing the cost.;0;2022-05-10 02:46:25;t3_um78dl;/r/StepN/comments/um78dl/currently_have_3_shoes_i_lvl_9_unsure_whether_to/i8050qj/
1375;goonsquadd69;Yeah it’s only at level 10 and 20 that you get charged a larger sum.  If you google “stepn level up cost” you can find a chart showing the cost.;0;2022-05-10 02:45:59;t3_um78dl;/r/StepN/comments/um78dl/currently_have_3_shoes_i_lvl_9_unsure_whether_to/i804ysz/
1376;JasonAdmin4;"Hi mates Got 10 new STEPN codes available
follow to get yours";0;2022-05-10 02:44:33;t3_qcknwv;/r/StepN/comments/qcknwv/rstepn_lounge/i804sdo/
1377;iamatc;Stepn/binance connection was having issues. Most likely related to that.;0;2022-05-10 02:32:53;t3_um4nhm;/r/StepN/comments/um4nhm/should_i_use_the_points_on_this_new_sneaker/i803c4v/
1378;Low_Moose_6829;Ik GameStop wasn’t a ponzi but be real, the stock wasn’t valued at 400. The whole concept of gamestop was a short squeeze, to margin call the majority investors that were selling short. For GameStop apes to make money, they needed to margin call investors, clearly not rooting in their favor. Do I fault GameStop apes for this, no, they get applauded for recognizing the opportunity like I’m doing with stepn;0;2022-05-10 02:26:03;t3_um7hq1;/r/StepN/comments/um7hq1/how_long_until_this_clear_ponzi_collapses/i802h8p/
1379;hearsdemons;"The markets are all taking a brutal hit right now. Bitcoin is under $32k, was $40k five days ago. Eth same thing, $2.9k five days ago, $2.2k now. Sol $95 five days ago, $60 today. Everything is been torn to pieces. It’s a complete bloodshed, red everywhere. 

There is no way Stepn or anything else will be immune from this. It’s a crypto after all and when people are panicking, crypto is the first thing they’re pulling their money from. So, GST drops from $10 to $3.50 in about two week’s time and I don’t even blink. It’s the markets doing its thing.";0;2022-05-10 01:11:20;t3_um67q3;/r/StepN/comments/um67q3/gmt_and_gst_falling_dramaticallythoughts_as_to_why/i7zsfad/
1380;Ok-Anything-5226;Anyone know how to use STEPN in the United States? It won’t let me put money into my wallet using Binance because of my location;0;2022-05-10 00:36:22;t3_um4nhm;/r/StepN/comments/um4nhm/should_i_use_the_points_on_this_new_sneaker/i7zntgp/
1381;Ok-Anything-5226;Is STEPN allowed in the United States? If so how do I do it. I cannot do anything with my Solana Wallet because Binance doesn’t allows United States;0;2022-05-10 00:33:29;t3_ulv2ak;/r/StepN/comments/ulv2ak/1_upvote_1code_in_message_if_you_upvoted_this/i7znfvj/
1382;Martinaharley;"https://youtube.com/shorts/4XR4VfrCJp8?feature=share 
STEPN CHECK";0;2022-05-10 00:33:07;t3_ullzaa;/r/StepN/comments/ullzaa/just_minted_this_beauty_first_mint_for_me/i7zne0n/
1383;ChemistIndividual658;Get on Twitter and keep on updating key words STEPN code;0;2022-05-09 22:56:26;t3_qcknwv;/r/StepN/comments/qcknwv/rstepn_lounge/i7zapvq/
1384;mirror_mirror20;hi - I'm looking to join stepN but was having trouble getting an activation code;0;2022-05-09 22:47:33;t3_qcknwv;/r/StepN/comments/qcknwv/rstepn_lounge/i7z9jw0/
1385;janvidb;Shouldn't STEPN implement something to avoid selling the GST immediately after getting them? I feel this is contributing to a lot of people selling. Like you cannot sell the GST from a run you just did within 24hrs;0;2022-05-09 22:38:38;t3_qcknwv;/r/StepN/comments/qcknwv/rstepn_lounge/i7z8dbu/
1386;janvidb;Shouldn't STEPN implement something to avoid selling the GST immediately after getting them? I feel this is contributing to a lot of people selling. Like you cannot sell the GST from a run you just did within 24hrs;0;2022-05-09 22:36:29;t3_ulpo6h;/r/StepN/comments/ulpo6h/the_whole_crypto_market_is_down_relax/i7z8354/
1387;Skyytek;According to the stepn team we can only have one code at the time 😌 but now that the one I posted is used I ll have another one to share tomorrow;0;2022-05-09 22:07:21;t3_um28ft;/r/StepN/comments/um28ft/getting_new_codes_daily_so_here_is_the_one_from/i7z45un/
1388;Khmaladze;"That definition still suits stepn as per my understanding.

I don't think it's: 1.gaming 2.fitness 3. finances ; it's just 3. Finances. Nobody's paying anything for stepn if there were no earinings.

I'm not trying to dissmiss stepn. Happy to see that you and so many others are having fun and making some cash at the same time. On the contrary, I'm trying to see if there are any risk-reducing factors to maybe stepIN the game myself. 

There are high chances I'd make my money back if I started now, but losing $1000 would be a great hit to me, while making $1000 wouldn't affect my life that much. I'm only trying to assess the risk.";0;2022-05-09 22:06:19;t3_ulpo6h;/r/StepN/comments/ulpo6h/the_whole_crypto_market_is_down_relax/i7z40wo/
1389;jamalccc;I’m completely new to StepN. Do you lose those two shoes this new one is minted from?;0;2022-05-09 22:03:29;t3_ulmfdz;/r/StepN/comments/ulmfdz/devastated_minted_2x_uncommon_shoes_together_and/i7z3n5k/
1390;Outrageous-Pick-9793;nabend Leute vielleicht kann mir jemand helfen .... ich habe heute an mein stepn solana wallet coins gesendet allerdings  kommen die nicht an und wenn ich nach der transaktions id such sagt der mir immer not found .... weisss jemand rat;0;2022-05-09 21:15:01;t3_qcknwv;/r/StepN/comments/qcknwv/rstepn_lounge/i7ywvhb/
1391;running_kate19;Can I send from Binance to my coinbase wallet and then to stepn ? And maybe I can solve the problem ?;0;2022-05-09 21:09:23;t3_ulzpji;/r/StepN/comments/ulzpji/binance_solana_network_suspended/i7yw2wk/
1392;Pi11r0113r;What is moonwalking on Stepn?;0;2022-05-09 20:44:57;t3_qcknwv;/r/StepN/comments/qcknwv/rstepn_lounge/i7yslfo/
1393;Gorczz;If it takes for than 24 hours you should make a claim on Discord STEPN channel;0;2022-05-09 20:34:50;t3_ulzxqa;/r/StepN/comments/ulzxqa/transferred_sol_between_wallets_missing_now_for/i7yr4j1/
1394;suibhne_geilt;Same, annoying isn’t it? Nothing to do with Stepn though.;0;2022-05-09 20:28:30;t3_ulzpji;/r/StepN/comments/ulzpji/binance_solana_network_suspended/i7yq7m0/
1395;marioredditcom;I can’t send sol from binance. What is going on? Is this forever , if it is, stepn has no future;0;2022-05-09 20:19:06;t3_ulzpji;/r/StepN/comments/ulzpji/binance_solana_network_suspended/i7yotdu/
1396;leopardoo;Do you think stepn have bright future ??;0;2022-05-09 20:06:59;t3_ulzizj;/r/StepN/comments/ulzizj/even_if_gst_went_to_1_its_a_passive_income_right/i7yn295/
1397;Equal_Ad1759;Stepn does the swaps on Orca;0;2022-05-09 20:01:23;t3_ulrazs;/r/StepN/comments/ulrazs/new_minting_cost_announced_in_discord/i7ym8sk/
1398;yonks;"Thanks for sharing!!

I’m excited to #STEPN and #MoveToEarn here in 2022!!

This game is already having positive impacts physically for my family and we are just getting started.";0;2022-05-09 19:59:32;t3_ulzhko;/r/StepN/comments/ulzhko/breaking_whats_the_future_of_gst_some_thoughts/i7ylyzy/
1399;yonks;"To clarify … if you have to actively do something (IE: walk / jog / run) that would not be characterized as “passive income”

Now if you develop a StepN Sneaker collection that you enroll into the rental program and someone is walking / running your sneakers and you are receiving 70% of those GST earnings … that is definitely passive income.

Note: Sep-2022 is current Roadmap for Rental Program";0;2022-05-09 19:56:07;t3_ulzizj;/r/StepN/comments/ulzizj/even_if_gst_went_to_1_its_a_passive_income_right/i7ylgru/
1400;Consistent_Ad_3616;"It is constantly evolving if you follow STEPN. White paper is outdated and this was the info I was looking for. Thanks for your insightful comment :) 
https://www.reddit.com/r/StepN/comments/ulrazs/new_minting_cost_announced_in_discord/?utm_source=share&amp;utm_medium=ios_app&amp;utm_name=iossmf";0;2022-05-09 19:53:39;t3_ulk7ms;/r/StepN/comments/ulk7ms/minting_costs/i7yl3q2/
1401;yonks;"Have you listened to any podcasts / AMAs / etc with Jerry or Yawn on them?  If you haven’t, I would really encourage you to do that.

Here is a link to a podcast that I recently listened to which may help to answer your question:

# Is STEPN a long term project?

https://decryptingcrypto.xyz/s05/stepn-move-and-earn/";0;2022-05-09 19:53:25;t3_ulzizj;/r/StepN/comments/ulzizj/even_if_gst_went_to_1_its_a_passive_income_right/i7yl2j9/
1402;yonks;"You need to understand …

# definition of a pyramid scheme

&gt; *“pyramid schemes — illegal arrangements in which participants make most of their money not by selling a product, but simply by recruiting more members”*

StepN has a great product which brilliantly combines 3 profitable areas into a single app which is a great UX/UI.
What are these “3 profitable areas”?

1. Gaming
2. Fitness
3. Finances

Do I believe that these NFT Sneakers will perpetually demand a ~$1k+ price tag? Absolutely not … at some point in the unknown future the supply / demand will likely level off.

Do I believe that I will continue to earn $300-500+ on a ~1hr run forever? Of course not

Am I having the “time of my life” playing a profitable mobile game all while increasing my physical fitness? ***ABSOLUTELY!!***";0;2022-05-09 19:40:50;t3_ulpo6h;/r/StepN/comments/ulpo6h/the_whole_crypto_market_is_down_relax/i7yj78f/
1403;Rishi_Nayak;guys good time to start on stepn;0;2022-05-09 19:37:53;t3_qcknwv;/r/StepN/comments/qcknwv/rstepn_lounge/i7yirb2/
1404;Robertus00;https://discord.gg/stepn;0;2022-05-09 19:37:45;t3_ulyjip;/r/StepN/comments/ulyjip/discord_server_link/i7yiqkq/
1405;yonks;"You are missing the fact that there is so much demand on BSC for GST that token is currently &gt; $22 … which is 7x of GST on SOL

My post / reply was in response to the OP’s subject:

# Will STEPN boom again

I was indicating that the price of GST doesn’t correlate to shrinking momentum / demand for the game.";0;2022-05-09 19:31:21;t3_ulwdg3;/r/StepN/comments/ulwdg3/will_stepn_boom_again_im_mean_who_believes_gst/i7yhsc6/
1406;lj20190101;Does anyone have another stepn code?;0;2022-05-09 19:13:04;t3_uly73t;/r/StepN/comments/uly73t/i_dont_wanna_be_that_guy_but_can_somebody_send_me/i7yf42s/
1407;Robertus00;You can swap GST/SOL/USDC for GMT on the StepN app;0;2022-05-09 19:10:10;t3_ulrazs;/r/StepN/comments/ulrazs/new_minting_cost_announced_in_discord/i7yeotv/
1408;kmamidala;"Were you on Tiktok or Reddit?  
I was initially surprised that a Redditor with 7k+ karma would scam.   
Then I searched for the username Important\_Fishing\_ . Doesn't seem to exist on Reddit.   
I'm glad you weren't scammed by this thief.  
Karma on Reddit exists for a reason. You can click on any username and see all the posts and responses they've made, as well as their karma stats. Always do this if someone claims to be a Redditor.  
If someone has no or little karma, or has two posts, or obviously scammy posts, STAY AWAY!

And to reiterate for everyone, there IS NO STEPN CHAT SUPPORT CURRENTLY!";0;2022-05-09 18:58:04;t3_ulx1q9;/r/StepN/comments/ulx1q9/exposing_scammers_one_at_a_time/i7ycwkt/
1409;Mathmodano;Yeah due to the fact that stepn will not be sustainable for years people think that the price is going down because stepn has reach is limit and they panic sell their shoe and take out everything but just so you know its only the bearish cryptos market that is going down  .. actually not only crypto but stock markey too world recession is coming hard but stepn is still sustainable it will go up after tthe panic quitters.;0;2022-05-09 18:06:24;t3_ulvr8h;/r/StepN/comments/ulvr8h/sol_gst_gmt_shoe_prices_going_down_is_it_an/i7y5c8l/
1410;Leafs4Life77;It's disappointing that StepN\_Official or the Mods won't clean up this community a bit. There are dozens of scams posted daily and countless other low quality posts (selling codes, begging for codes, offering codes, etc.);0;2022-05-09 18:04:53;t3_ulx1q9;/r/StepN/comments/ulx1q9/exposing_scammers_one_at_a_time/i7y54dz/
1411;hearsdemons;Thank you for exposing these scammers. More of these posts, less people they’ll be able to have success with. Anyone asking to authenticate your Stepn account with your seed phrase, or asking you to click a suspicious link, or use some QR code is trying to hack into your account. Please be careful out there.;0;2022-05-09 18:00:12;t3_ulx1q9;/r/StepN/comments/ulx1q9/exposing_scammers_one_at_a_time/i7y4f45/
1412;HeavyweightHippopo;"Happy STEPN 

80136813";0;2022-05-09 17:53:28;t3_ulpo6h;/r/StepN/comments/ulpo6h/the_whole_crypto_market_is_down_relax/i7y3fkv/
1413;yonks;"There is no other place than StepN, in today’s market, that I would suggest someone to allocate the $1k for a pair of sneakers. If they are going to take the 11min/day to go walk and earn GST.

#DYOR

Do Your Own Research

This morning I went for a 1h3min run and earned 97.58 GST with my Level 19 Runner with a “9 Sneaker Strategy”. I burned 12.6 energy. At current market rate of $3.90 that is $378.61 … even if GST drops another 50% … that is still $189.30

I have only been playing this game 4 weeks. I’m expecting my GST earnings to increase as I’m not even to my daily GST cap and I just acquired an Uncommon runner the other day which I am still leveling to replace my Lvl 19 Common Runner.";0;2022-05-09 17:39:23;t3_ulvr8h;/r/StepN/comments/ulvr8h/sol_gst_gmt_shoe_prices_going_down_is_it_an/i7y1c26/
1414;kmamidala;"Bitcoin Daily (Jay) is in Miami, and he's all over Youtube with Stepn.  
I think that might just be boilerplate verbiage from Stepn to cover their ass with the US authorities, because the status of crypto in the US is still being determined by the SEC (re: Ripple)";0;2022-05-09 17:35:54;t3_ulgb9j;/r/StepN/comments/ulgb9j/any_users_here_from_the_us/i7y0tg9/
1415;Psychopassion;This is the good time to join stepn) 66885507;0;2022-05-09 17:30:46;t3_uln2be;/r/StepN/comments/uln2be/get_activation_code_right_now/i7y01ql/
1416;yonks;"For sure!!

The other benefit of a Level 0 … if you do StepN for a week or 2, get your Sneaker to Level 9 … you can probably “walk away”, sell the sneaker, feeling like you didn’t lose anything financially.";0;2022-05-09 17:14:31;t3_ult31p;/r/StepN/comments/ult31p/is_this_shoe_any_good_about_to_buy_it/i7xxlda/
1417;hearsdemons;The shoe prices are tied to the price minters will sell it for. So maybe that explains the lag in prices going down for sneakers. If minters minted shoes a few days ago when GST was still hovering around $5 and GMT $2.50, and Sol was worth $80, they would still want to keep the shoe prices a bit high to come off profitable from their minting. I’d think out of all the items in the game, shoe prices would move the slowest. GST/GMT will immediately drop with news from Stepn or the general markets, but those changes take time to reverberate through and start effecting shoe prices.;0;2022-05-09 17:08:28;t3_ulvr8h;/r/StepN/comments/ulvr8h/sol_gst_gmt_shoe_prices_going_down_is_it_an/i7xwom1/
1418;chrissage;Hey pal. A good way to do it is have the Stepn app open ready to insert the code. With a computer it tablet gave telegram, discord and reddit open. As soon as you see a code come up, smash them thumbs fast. Good luck.;0;2022-05-09 16:55:07;t3_ulup0p;/r/StepN/comments/ulup0p/so_many_people_asking_for_stepn_activation_code/i7xuo6g/
