;author;body;controversiality;created;link_id;permalink
1885;Exotic-Caterpillar70;"You need to value the fact that you can level three sneakers at the same time.  This has significant value...if you focus on leveling all the sneakers up at the same time then you will have three high-performing shoes in a couple weeks that will perform at 6 energy vs 4 energy.  I believe this to be most profitable if you have the risk tolerance to be a long-term holder.  

I've correlated this to a game of digital real estate that incentivizes you to put capital back into the deal to generate higher returns at a later date.  This is not exactly apples to apples but it plays out like this.  The sneaker is the house/the NFT is the land, GST is the bank, offering debt and interest, GMT is equity.  Solana is the dollar that buys the house.  If you level up the sneaker (pay GST), you are paying off the principal of the loan that you borrowed from the bank.  Now if you get an interest free loan (ie don't level up your sneaker) then yes in the short term you will cash flow nicely, but you are not building equity in the house unless the market has no inventory.  This is not California 2022, this is California 1849.   
Since we know there is a lot more housing supply (shoes) to hit the market, the price of sneakers will stay somewhat stable as they slowly introduce demand and counter any supply imbalance with minting events.  I believe we can estimate where we are on total shoe supply by the amount of GMT that has been released into the market.  When you get to level 30 GST earnings turn into GMT, which is like saying your house is now paid off, now you are in the equity.  If the ratio of equity (GMT) to debt (GST) gets out of whack, ""the fed"" or stepn in this case will put in temporary policies to help the economics to stabilize and not throw us into a recession.  Minting or ""wear and tear"" leads to the depreciation of the asset.  Just like in Monopoly, the goal is to own as much real estate as possible.  I believe Stepn is building towards that in their rental model.  Just like someone who owns a lot of rental properties, the goal is to create passive income/mailbox money.  Now some people will say but you earn GST, how is that debt.  Well GST is like the money you're borrowing from the bank to get the shoe up in value.  You have to constantly spend it to increase your position, similarly you constantly spend money on your mortgage to pay down the principle.  And every once in a while you make capital improvements, new roof, paint, etc (ie spend GMT, equity) that is required at leveling up during level 5, level 10, etc.  Oh and isn't it interesting that the price of GMT and GST has been floating around the 35%/65%  ratio lately?  This is a typical equity to debt relationship on your basic commercial real estate deal.

I've thought about this too much.  I really enjoy the game theory.";0;2022-05-05 17:29:37;t3_uivqj1;/r/StepN/comments/uivqj1/you_are_allowed_to_use_multiple_accounts/i7g7qn3/
1886;hearsdemons;"I’m not sure. But basing it off [this comment](https://www.reddit.com/r/StepN/comments/tc5zm7/warning_theres_a_chance_you_lose_everything/i0cav5f/?utm_source=share&amp;utm_medium=ios_app&amp;utm_name=iossmf&amp;context=3), it looks like it costs 100 GST to upgrade a level 2 gem.";0;2022-05-05 17:18:01;t3_uj1tcy;/r/StepN/comments/uj1tcy/hi_all_do_you_guys_know_what_is_the_price_of/i7g5zds/
1887;Atmons;The Stepn guide says you should have your Resilience at 10.7;0;2022-05-05 17:14:21;t3_uizkum;/r/StepN/comments/uizkum/i_get_1057_gst_with_these_attributes_and_lose/i7g5f94/
1888;Particular_Pickle798;"Before screaming they scammed you, can’t you simply say that you received 2.1 SOL instead 19.325 and you need help ? Problem in the system can occur, that doesn’t mean they are scamming you. 

Nothing against your post, and I hope they will take care of your case asap. 
We see similar issues on the discord and they get resolve at some point. I don’t think STEPN is interest in 16SOL…";0;2022-05-05 17:07:07;t3_uiz4it;/r/StepN/comments/uiz4it/warning_stepn_scammed_me_out_of_16_sol/i7g4byr/
1889;OkDivide6924;Thanks for this piece , it's very informative . Planning on getting stepn soon and the info you put out will help a lot.;0;2022-05-05 16:31:23;t3_uj0zh7;/r/StepN/comments/uj0zh7/some_information_for_new_users/i7fzoc0/
1890;Confident-Broccoli86;I got a trainer as a main, never pause on the run and walk, sadly it was fit on low level but no more , stepn definitely did something I hope not to believe it's a scheme , thanks anyway;0;2022-05-05 16:19:47;t3_uj0spu;/r/StepN/comments/uj0spu/stepn_give_less_gst_than_calculated_amount/i7fxy0i/
1891;yonks;"You will receive better ROI with (3) Commons than (1) Uncommon.

There is a “flex your earnings” channel on STEPN discord that has a lot of screenshots.";0;2022-05-05 16:18:08;t3_uj0zxd;/r/StepN/comments/uj0zxd/share_uncommon_sneaker_earning/i7fxozd/
1892;Ok_Farm_4653;Hey if u want a free code just go here: [https://www.reddit.com/r/StepN/comments/uiwizf/every\_upvote\_1\_code\_in\_comment\_under\_this\_post\_73/](https://www.reddit.com/r/StepN/comments/uiwizf/every_upvote_1_code_in_comment_under_this_post_73/) and upvote the post, and check the comment!;0;2022-05-05 15:50:30;t3_qcknwv;/r/StepN/comments/qcknwv/rstepn_lounge/i7ftfwm/
1893;yonks;"You should start with STEPN’s Medium … they have created a lot of posts that should answer your questions.

Scrolling through their posts … this one may provide some insights:

STEPN Discord NFT Airdrop Campaign Q&amp;A
https://stepnofficial.medium.com/stepn-discord-nft-airdrop-campaign-q-a-61d2099144e6";0;2022-05-05 15:49:51;t3_uj0ax0;/r/StepN/comments/uj0ax0/question_sneakers/i7ftcaf/
1894;yonks;Congrats on your 1st STEPN run!!;0;2022-05-05 15:45:18;t3_uizfln;/r/StepN/comments/uizfln/first_run_with_my_new_joggers_pretty_happy_with/i7fsn4p/
1895;mikaelrshj;i know that im just bored and i mean market not just stepn btc is creating supply and demand i think it will sse even 35 from there it can go to 55,57;0;2022-05-05 15:44:53;t3_uj04bb;/r/StepN/comments/uj04bb/thoughts_on_market_dump/i7fskxo/
1896;No_Persimmon_9372;Message came in as STEPN support because is from their official discord;0;2022-05-05 15:42:56;t3_uij65a;/r/StepN/comments/uij65a/scam_or_legit_someone_sent_this_to_me_on_discord/i7fsa8h/
1897;bitcrazy42;I took my res. To 14 just so the repair was a little less,  the stepn guide optimizer says I should have stopped at 10 res and put more into eff.  The difference seems minimal but over time every GST counts;0;2022-05-05 15:40:18;t3_uizkum;/r/StepN/comments/uizkum/i_get_1057_gst_with_these_attributes_and_lose/i7frvu1/
1898;Chooky47;"It doesn’t make a difference for resilience 10-13, as shown in your own image, because it works increments. 

Read your own image carefully, and then consider what the STEPN guide shows you - they are showing the same data at work. 

Every *few* points of resilience makes a difference, not every individual point. 

Take the time to figure it out and you’ll see.";0;2022-05-05 15:25:47;t3_uincjw;/r/StepN/comments/uincjw/i_got_to_lvl_14_in_hopes_of_loosing_only_8/i7fpogh/
1899;beesareinthewhatnow;"I always just use this tool and do what it says https://www.workitwallet.com/post/stepn-level-up-tool

https://Stepn.guide is another one.";0;2022-05-05 15:18:57;t3_uizkum;/r/StepN/comments/uizkum/i_get_1057_gst_with_these_attributes_and_lose/i7fon0r/
1900;kissvisylove;all codes are 8 digits even those from Stepn discord;0;2022-05-05 15:07:38;t3_qcknwv;/r/StepN/comments/qcknwv/rstepn_lounge/i7fmy6o/
1901;samkb93;https://discord.gg/stepn;0;2022-05-05 14:35:12;t3_uix7jq;/r/StepN/comments/uix7jq/network_busy_please_try_again_later/i7fi4tc/
1902;reverent-girl;I’m not stupid. I know what I’m getting into. From what I can tell from researching, StepN is barely less of a Ponzi scheme than Bitcoin. People have been saying BTC will collapse for the past decade. That does not change the fact that many people have made millions. My friend who got into StepN with a $5k investment a few months ago has already made $18k. Ponizi or not, if you have a taste for risk than there is money to be made.;0;2022-05-05 14:35:10;t3_uirvwc;/r/StepN/comments/uirvwc/i_have_1_shoe_how_should_i_invest_now/i7fi4lf/
1903;meoffagain;Received! I'm Stepn out for a walk right now!;0;2022-05-05 14:30:21;t3_uis9xw;/r/StepN/comments/uis9xw/1_activations_code_giveaway_at_30_upvotes/i7fhezf/
1904;Wrong_Resource5243;"""Network busy, please try again later""

so apparently the app doesn't work,
It shows ""Network busy, please try again later"". also, my home page says ""refresh failed"", where I can't even see my sneakers. I did try several ways by looking at some more users facing the same problem. where we as a user discussing using VPN, or restart the phone, or shutting down wifi where I tried all the ways and also having a good network or internet connection but nothing works. 
I look forward to the STEPN team looking into this matter and providing a stable solution. Many thanks!!


hello@stepn.com [hello@stepn.com](hello@stepn.com)";0;2022-05-05 14:23:22;t3_uix7jq;/r/StepN/comments/uix7jq/network_busy_please_try_again_later/i7fgeay/
1905;Big_Fall6229;it's BACK 🥳🥳 stepn is the best;0;2022-05-05 14:23:15;t3_qcknwv;/r/StepN/comments/qcknwv/rstepn_lounge/i7fgdoy/
1906;Wrong_Resource5243;"My email to hello@stepn.com looks something like this. 


""Network busy, please try again later""

so apparently the app doesn't work,
It shows ""Network busy, please try again later"". also, my home page says ""refresh failed"", where I can't even see my sneakers. I did try several ways by looking at some more users facing the same problem. where we as a user discussing using VPN, or restart the phone, or shutting down wifi where I tried all the ways and also having a good network or internet connection but nothing works. 
I look forward to the STEPN team looking into this matter and providing a stable solution. Many thanks!!";0;2022-05-05 14:13:05;t3_ts7mas;/r/StepN/comments/ts7mas/network_is_busy/i7fewut/
1907;Wrong_Resource5243;Not yet, i have tried all the ways discussed online from community people but finally had to email stepn for the issue.;0;2022-05-05 14:10:02;t3_ts7mas;/r/StepN/comments/ts7mas/network_is_busy/i7fehhq/
1908;bitcrazy42;"Go to the stepn discord and click announcements: snapshot shown below:

ANNOUNCEMENT: 

Hello @everyone . 

We have received reports of people getting server busy errors. This is being investigated at the moment.

Will update here as soon as we have information. Thank you.";0;2022-05-05 13:42:46;t3_uix7jq;/r/StepN/comments/uix7jq/network_busy_please_try_again_later/i7faq8r/
1909;IAmHugger;Guys im new to stepn, has this happened before? not panicking, just interested if this is the first incident or no;0;2022-05-05 13:41:41;t3_qcknwv;/r/StepN/comments/qcknwv/rstepn_lounge/i7fal1x/
1910;Hasnat87;what's really happening? there's so much talk about stepn being a ponzi and now there app is not working and people will loose todays energy if its not resolved in time. how long this app will last?!;0;2022-05-05 13:29:21;t3_qcknwv;/r/StepN/comments/qcknwv/rstepn_lounge/i7f8z3z/
1911;Significant-Cell-181;"I don’t have anymore codes at the moment, but here is an article that talks about some other ways to get codes. Good luck!

[https://www.workitwallet.com/post/stepn-activation-code](https://www.workitwallet.com/post/stepn-activation-code)";0;2022-05-05 13:07:37;t3_uivjc4;/r/StepN/comments/uivjc4/impossible_to_get_one_activation_code/i7f67ek/
1912;Significant-Cell-181;"I don’t have anymore codes at the moment, but here is an article that talks about some other ways to get codes. Good luck!

[https://www.workitwallet.com/post/stepn-activation-code](https://www.workitwallet.com/post/stepn-activation-code)";0;2022-05-05 13:06:52;t3_uivhjy;/r/StepN/comments/uivhjy/in_need_of_code_please_help/i7f642z/
1913;Defiant-Class-4638;Why does it seem the higher the level the less you make with stepn wiki;0;2022-05-05 12:59:40;t3_uivqj1;/r/StepN/comments/uivqj1/you_are_allowed_to_use_multiple_accounts/i7f58g9/
1914;Significant-Cell-181;"I don’t have anymore codes at the moment, but here is an article that talks about some other ways to get codes. Good luck!

[https://www.workitwallet.com/post/stepn-activation-code](https://www.workitwallet.com/post/stepn-activation-code)";0;2022-05-05 12:52:47;t3_uiwejw;/r/StepN/comments/uiwejw/can_i_have_a_code_pls/i7f4efh/
1915;Steezus27;I don’t need a code. I’ve entered a few “successfully” with no further action from STEPN. That’s why I’m here… I see others on Twitter have similar issues but no-one offers any help.;0;2022-05-05 12:51:35;t3_uiwmx9;/r/StepN/comments/uiwmx9/ive_successfully_entered_an_activation_code_2/i7f4980/
1916;Significant-Cell-181;"Try the level up tool on workitwallet.com!

You can input the type and quality of your sneaker as well as the current and desired level. Then add the Base and Current stats of your sneaker to see how the stats can be best optimized for earnings at your desired level.

Good luck friend!

[https://www.workitwallet.com/post/stepn-level-up-tool](https://www.workitwallet.com/post/stepn-level-up-tool)";0;2022-05-05 12:31:49;t3_uitwwl;/r/StepN/comments/uitwwl/what_to_do_with_attribute_points_keep_them_for/i7f1xu1/
1917;Rishi_Nayak;there is no stepn support 🤦;0;2022-05-05 12:29:04;t3_qcknwv;/r/StepN/comments/qcknwv/rstepn_lounge/i7f1ms0/
1918;Dan_Da_Da;I have a question and hope some can help me about it! I just talked with someone from the Stepn Support and he told me that I have to pay 100$ to validate my activation code. Is it true?🤔;0;2022-05-05 12:27:21;t3_qcknwv;/r/StepN/comments/qcknwv/rstepn_lounge/i7f1frr/
1919;Sergio_Andre;"In whitepaper there’s nothing, but I’ve contacted the Team support in app ticket, bellow is the answer. But in my case is a legitime case:

Maria (STEPN)
Apr 29, 2022, 19:26 GMT+10

Hi (myemail),
 
Thank you for reaching out to STEPN Customer Support. Let me help out! 
 
I understand that you want your wife to have her own account.
 
You can definitely set an account for your wife. You may either transfer you Sneaker or purchase a Sneaker from the Marketplace to get her started. If you are worried on the possibility of account sanctions due to the fact that you and your wife walk together, please note that as long as you have individual accounts and using different devices, it will not be counted as multi-accounting.
 
I hope this clarifies! Should you have any questions, please feel free to let us know.
 
Kind regards,
Maria
STEPN Support Specialist";0;2022-05-05 12:15:13;t3_uivqj1;/r/StepN/comments/uivqj1/you_are_allowed_to_use_multiple_accounts/i7f03xt/
1920;AdDry5377;Salty guy… you go earn those peanuts with the other rug pulls. I’m happy right where I am on STEPN.;0;2022-05-05 11:39:17;t3_ui4w22;/r/StepN/comments/ui4w22/stop_pumping_the_ponzi_2_stepn_alternatives/i7ewggf/
1921;Forward-Yesterday-85;Can I do anything about it? No answer from Stepn and Binance said they cannot do;0;2022-05-05 10:32:59;t3_uiuipt;/r/StepN/comments/uiuipt/sent_sol_to_bsc_stepn/i7eqo5g/
1922;Bellazonia;Ponzi prices?? Yes 1k$ is alot for a shoe NFT but you can make ROI in 30-45 days, depending on Shoe quality and strategy. Game in NFT’s are always expensive, in every game. In STEPN you actually can ROI from them quite fast.;0;2022-05-05 09:48:42;t3_uipl3n;/r/StepN/comments/uipl3n/to_people_asking_for_activation_codes/i7ene7v/
1923;PhoenixxBasit;looking for stepn nft dev;0;2022-05-05 09:24:32;t3_qcknwv;/r/StepN/comments/qcknwv/rstepn_lounge/i7elqne/
1924;rubinidaIII;StepN og;0;2022-05-05 09:21:11;t3_ui8ed0;/r/StepN/comments/ui8ed0/is_stepn_threatened_by_step_app_what_is_your/i7elico/
1925;Odd-Entry-9839;Anybody have a code? Planning on Stepn in to the community and grab some runners;0;2022-05-05 09:07:53;t3_uipl3n;/r/StepN/comments/uipl3n/to_people_asking_for_activation_codes/i7eklxo/
1926;boohjaka;"Dafuq you taking about? Depending on where you live,  your tax dollars work a lot harder than you think. Easy ones are schools, police, fireman, hospitals, roads, military, etc etc. 

Stepn, well let's just say that the people who bought their first shoe at 18sol a week ago would probably disagree with you on the roi - granted it's short term.";0;2022-05-05 09:00:21;t3_ui64pj;/r/StepN/comments/ui64pj/artist_royalties_4_fee_on_every_sale_from_minted/i7ek3eq/
1927;eihrana;you can test it on stepn guide. com;0;2022-05-05 08:47:08;t3_uis9kh;/r/StepN/comments/uis9kh/is_there_any_resilience_energy_points_damage/i7ej7n1/
1928;Tough_Leg_2001;Seems good. Enjoy stepn !;0;2022-05-05 08:36:26;t3_ui9nn4;/r/StepN/comments/ui9nn4/bought_my_first_one_today_wish_me_luck/i7eii3y/
1929;7yod;"Make sure he/she will use it. 
… After 1 year you check with your friend and she/he forgets about it and Stepn hype has gone.";0;2022-05-05 08:28:16;t3_uima62;/r/StepN/comments/uima62/how_much_is_this_shoe_worth_wanna_sell_to_my/i7ehyq0/
1930;Chucking100s;"Early on - because of the exact problem you are experiencing 

STEPN decided to give away shoes for free via quizzes on Discord. 

Unfortunately now that growth is now parabolic and demand shows no signs of dying down there is slim to no chance you'll get a shoe without buying it. 

Until of course renting / leasing when it is released in Q3";0;2022-05-05 07:57:47;t3_uinto2;/r/StepN/comments/uinto2/how_much_my_sneakers_worth/i7efy2t/
1931;assthots;yeah, but of the government would have a ROI of stepn I'd be damned;0;2022-05-05 07:36:22;t3_ui64pj;/r/StepN/comments/ui64pj/artist_royalties_4_fee_on_every_sale_from_minted/i7eehwp/
1932;goodday391;dm me, if you really want to buy nft sneaker and use stepn app;0;2022-05-05 07:08:24;t3_qcknwv;/r/StepN/comments/qcknwv/rstepn_lounge/i7eciud/
1933;Large-Reception-387;I would say those are scams wouldn’t risk it because why is anyone going to sell their sneaker for $500 less when they can sell it on stepn market for more?;0;2022-05-05 07:00:25;t3_uikm2n;/r/StepN/comments/uikm2n/buying_a_sneaker_on_second_hand_marketplace/i7ebxib/
1934;Brief-Advisor224;用了你的办法， 安装了最新的StepN 结果打开就闪退;0;2022-05-05 05:52:30;t3_s5u5y2;/r/StepN/comments/s5u5y2/安卓手机安装谷歌组件运行stepn的最终解决方案/i7e6miu/
1935;amitjuneja16;Or you could set up a password in stepn so you don't need a verification code everytime you log in;0;2022-05-05 05:52:06;t3_uiqb7c;/r/StepN/comments/uiqb7c/lost_access_to_my_verification_e_mail_account/i7e6ldb/
1936;amitjuneja16;Or you could set up a password in stepn so you don't need a verification code everytime you log in;0;2022-05-05 05:28:21;t3_uips1j;/r/StepN/comments/uips1j/forgot_password_to_email_thats_linked_to_stepn/i7e4k3l/
1937;BoxyTheRunner;"https://www.reddit.com/r/StepN/comments/uiq6rq/is_it_better_to_have_3_pair_of_shoes_on_one/?utm_source=share&amp;utm_medium=ios_app&amp;utm_name=iossmf";0;2022-05-05 05:27:36;t3_uiq76k;/r/StepN/comments/uiq76k/2_phones_2_accounts_2_different_run/i7e4hsc/
1938;yonks;Multi-Accounting is a violation of StepN Terms of Service;0;2022-05-05 05:24:54;t3_uiq6rq;/r/StepN/comments/uiq6rq/is_it_better_to_have_3_pair_of_shoes_on_one/i7e49hc/
1939;C0ldCl0ud;yeah he is. If you haven't disabled private messages on the StepN discord server i would recommend to do so. There is a how to on the discord.;0;2022-05-05 04:45:53;t3_uip9uu;/r/StepN/comments/uip9uu/is_this_legit/i7e0p7p/
1940;joshmonkeykun;"went to ""corporal captor"" but can't add STEPN";0;2022-05-05 04:45:24;t3_uimugs;/r/StepN/comments/uimugs/step_counting_problem_with_redmi_note_8_pro/i7e0nk3/
1941;JamesIsBest87;SCAM!  Any private messages you get in discord, telegram, or reddit related to STEPN are a scam!;0;2022-05-05 04:11:54;t3_uij65a;/r/StepN/comments/uij65a/scam_or_legit_someone_sent_this_to_me_on_discord/i7dx7zq/
1942;razorbackaj;Nice - have really enjoyed Stepn. I am walking more than I have done in years.;0;2022-05-05 03:22:31;t3_ui9nn4;/r/StepN/comments/ui9nn4/bought_my_first_one_today_wish_me_luck/i7drn7o/
1943;Rishi_Nayak;you can only join stepn using activation code and it requires one week to get one code with one shoe;0;2022-05-05 02:47:24;t3_qcknwv;/r/StepN/comments/qcknwv/rstepn_lounge/i7dne3n/
1944;olsouthpancakehouse;The best way to help stepn long term is to ensure that high earning shoes can not do so in perpetuity. I would propose a new stat “tread level” be added. Once you’ve hit a total gst earned cap, the “tread” on your shoe is worn out. You can then “inspect” your shoe. “At the bottom of your tread you find gems!”.;0;2022-05-05 02:12:20;t3_uid2h9;/r/StepN/comments/uid2h9/improvement_idea/i7dixvw/
1945;International_Act627;"Hello I have STEPN, I would like to know for the coin GST what is the bridge can I use between solana and bep20?

Thank you";0;2022-05-05 02:01:06;t3_s8hd8c;/r/StepN/comments/s8hd8c/flex_your_daily_earnings/i7dhgfe/
1946;International_Act627;"Hello I have STEPN, I would like to know for the coin GST what is the bridge can I use between solana and bep20?

Thank you";0;2022-05-05 01:58:38;t3_qcknwv;/r/StepN/comments/qcknwv/rstepn_lounge/i7dh4gv/
1947;Beneficial_Meat4651;https://medium.com/coinmonks/6-simple-ways-for-getting-stepn-verification-code-a1d3c068d7dc pretty much all the options described in that article;0;2022-05-05 01:23:14;t3_qcknwv;/r/StepN/comments/qcknwv/rstepn_lounge/i7dcfbx/
1948;Significant-Cell-181;"Try this earnings calculator on workitwallet.com

[https://www.workitwallet.com/post/stepn-roi-calculator](https://www.workitwallet.com/post/stepn-roi-calculator)

You can then see the ideal level (and stats) to maximize earnings based on your time horizon (based on current prices)";0;2022-05-05 01:16:49;t3_uikm65;/r/StepN/comments/uikm65/any_suggestions_is_it_worth_to_upgrade_to_19/i7dbkd7/
1949;Beneficial_Meat4651;https://stepn-calculator.netlify.app/;0;2022-05-05 01:07:56;t3_qcknwv;/r/StepN/comments/qcknwv/rstepn_lounge/i7dadj5/
1950;Odd-Airline-925;I need please a code STEPN 🙏🙏;0;2022-05-05 00:16:06;t3_ui2wn2;/r/StepN/comments/ui2wn2/code_giveaway_for_like_and_comment_i_will_choose/i7d3bow/
1951;BomberXL;"hey, monday I got whitelisted for the ASICS Stepn Mint. 

I send 2 Solana over, and have yet to receive anything. is anyone else also experiencing this?";0;2022-05-05 00:05:58;t3_qcknwv;/r/StepN/comments/qcknwv/rstepn_lounge/i7d1zew/
1952;LucyLove980;If roaming is cheaper than what you earn on stepn, do that. If not, you will just have to sit this one out🤷‍♀️ Its not possible to use wifi or walk inside btw;0;2022-05-04 22:57:02;t3_uiane7;/r/StepN/comments/uiane7/stepn_airplane_mode/i7cssrj/
1953;Sufficient-Club-3353;Yes u can. Bt the other places have higher floor prices. StepN market place is better;0;2022-05-04 22:42:19;t3_uiabhg;/r/StepN/comments/uiabhg/is_it_possible_to_buy_shoes_to_use_on_stepn/i7cqsi9/
1954;Sufficient-Club-3353;Only walking won’t help u if u do not invest in stepn.. can u invest 1300 dollars right away?;0;2022-05-04 22:08:08;t3_uifgih;/r/StepN/comments/uifgih/activation_code_give_away/i7clx2z/
1955;MomentGlittering4527;I find the best results when Stepn is not minimized, just lock my screen when Stepn is on. Other apps don't affect, even phone calls work;0;2022-05-04 21:59:32;t3_uifdd3;/r/StepN/comments/uifdd3/is_it_ok_to_use_the_app_along_with_strava_to/i7ckm4n/
1956;Significant-Cell-181;"Try the Earnings Calculator from workitwallet.com. 

[https://www.workitwallet.com/post/stepn-roi-calculator](https://www.workitwallet.com/post/stepn-roi-calculator)";0;2022-05-04 21:58:13;t3_uihhcw;/r/StepN/comments/uihhcw/how_much_can_i_roughly_earn_with_3_sneakers1/i7ckes1/
1957;Ramisrafa;Un code stepn s'il vous plaît;0;2022-05-04 21:44:58;t3_ui2wn2;/r/StepN/comments/ui2wn2/code_giveaway_for_like_and_comment_i_will_choose/i7cieo4/
1958;Muted_Restaurant673;Anyway i have another question...i ve added sol at stepn from phantom...and i didnt recive them yet on my account..any issue with phantom?u know something?;0;2022-05-04 21:44:11;t3_uhfkod;/r/StepN/comments/uhfkod/just_bought_another_shoes_to_mint_does_this_mean/i7ciaeg/
1959;otherform;"Thanks!

Which app do you leave open at the forefront, runkeeper or STEPN?";0;2022-05-04 21:42:21;t3_uifdd3;/r/StepN/comments/uifdd3/is_it_ok_to_use_the_app_along_with_strava_to/i7ci06t/
1960;MEPHiSTO6666;If advertisers buy GST to give it to players who watch ads there is no net demand for GST unless they burn some of it. Also the price these ads pay is something like 0.01 USD per view so not particularly interesting for players who earn anything from 50 to 500 USD a day from walking/running nor particularly interesting for STEPN who makes a lot more from in game transactions. I don’t see paid ads (as in clips played in the app) happening;0;2022-05-04 20:45:25;t3_uid2h9;/r/StepN/comments/uid2h9/improvement_idea/i7c995z/
1961;yonks;I use RunKeeper in conjunction with StepN. It shouldn’t affect your earnings as long as your mobile device is somewhat recent and not under powered.;0;2022-05-04 20:43:39;t3_uifdd3;/r/StepN/comments/uifdd3/is_it_ok_to_use_the_app_along_with_strava_to/i7c8zcs/
